book	book_id	chapter	verse	text
Yôhanes	43	13	28	Ndi ikété bôt ba bé ba yii i téblé, to wada a bi yi bé inyuki a bi kal nye hala.
Yôhanes	43	13	29	Bahogi ba bé hoñol le kiki Yuda nyen a bééna nkuu moni, Yésu a bé kal nye le: “Somb i gwom bi mbéda bés inyu ngand,” tole a ti ndék jam inyu diyeyeba.
Yôhanes	43	13	30	Jon kiki a yoñ ndik hikét hi bret, a pam i nlélém ngéda. U u bé nsudge.
Yôhanes	43	13	31	Ndi ngéda a bi pam, Yésu a kal le: “Nano Man mut a nkôhna lipém, yak Nyambe a nkôhna lipém ni njel Man.
Yôhanes	43	13	32	Nyambe nyemede a’ ti nye lipém, a’ ti ki nye jo kunda yada.
Yôhanes	43	13	33	A boñge batitigi, me ngi yii lôñni bé inyu ndék ngéda. N’a yéñ me; ndik kiki me bi kal Lôk Yuda le: ‘I het me nke, ni nla bé lo nyoo,’ nano me nkal yak bé hala.
Yôhanes	43	13	34	Me yé i ti bé mbén mondo, le ni gwéhna bé ni bé; ndik kiki me bi gwés bé, yak bé ni gwéhna hala bé ni bé.
Yôhanes	43	13	35	Hala nyen bôt bobasôna b’a yi le ni yé banigil bem, ibale ni gwéhna bé ni bé.”
Yôhanes	43	13	36	Simôn Pétrô a bat nye le: “A Nwet, hee u nke?” Yésu a timbhe le: “I het me nke, u nla bé noñ me nano; ndi w’a yik noñ me i mbus ngéda.”
Yôhanes	43	13	37	Pétrô a bat nye le: “A Nwet, inyuki me nla bé noñ we nano? Me yé bebee i ti niñ yem inyu yoñ.”
Yôhanes	43	13	38	Yésu a timbhe nye le: “Baa u yé toi bebee i ti niñ yoñ inyu yem? Me nkal yaga we maliga le, nlôm kôp a yé mbén i oñ, we ngi tañba me ngélé aa.”
book	book_id	chapter	verse	text
Yôhanes	43	14	1	“Miñem minan mi siida bañ. Ni unda le ni nhémle Nyambe; ni unda ki le ni nhémle me.
Yôhanes	43	14	2	Mayééne ma yé ngandak i ndap Tata. Ibale hala bé, ki me nkal bé, inyule me nke i kôôbana bé homa.
Yôhanes	43	14	3	Handugi hala, ibale me nke, me kôôbana bé homa, m’a témb me lo, me leege bé i meeni inyu boñ le i homa me mba, yak bé ki ni ba ha.
Yôhanes	43	14	4	I homa me nke, ni nyi njel.”
Yôhanes	43	14	5	Tômas a kal nye le: “A Nwet, di nyi bé hee u nke. Lelaa ni di nla yi njel?”
Yôhanes	43	14	6	Yésu a kal nye le: “Men me yé njel, me yé maliga, me yé ki niñ. Mut to wada a nlo bé yak Tata handugi ni njel yem.
Yôhanes	43	14	7	Ibale bé ni yik toi me, ki ni nyi yak Tata; ibôdôl nano ni nyi nye, ni ntehe ki nye.”
Yôhanes	43	14	8	Filipô a kal nye le: “A Nwet, unda bés Tata, ki hala a nkola bés.”
Yôhanes	43	14	9	Yésu a kal nye le: “To hala kiki me ntégbaha ntandaa ngéda ni bé, a Filipô, baa we u yé ngi pam i yi me? Nu ni nu a ntehe me, wee a ntehe yak Tata. Lelaa ni u nkal le: ‘Unda bés Tata’?
Yôhanes	43	14	10	Baa u nhémle bé le me yé ikété adna ni Tata, yak Tata a yé ikété adna ni me? I mam me nkal bé, me mpot bé mo ni memede, ndi Tata nu a ntéñbe i ba ikété adna ni me, nyen a mboñ minson nwé.
Yôhanes	43	14	11	Ni hémle me, me yé ikété adna ni Tata, yak Tata a yé ikété adna ni me; ndi ibale ni nhémle bé hala, ni hémle to inyu minson nwomede.
Yôhanes	43	14	12	Me nkal yaga bé maliga le, nu ni nu a ñunda le a nhémle me, yak nye a’ boñ minson me mboñ; a’ boñ ki minson mi nloo mini, inyule me nke yak Tata.
Yôhanes	43	14	13	Jam lipe ki, to kinjee jam ni mbat i jôl jem, m’a boñ jo, le ndi Tata a kôhna lipém ni njel Man.
Yôhanes	43	14	14	Ibale ni mbat to kinje jam i jôl jem, m’a boñ jo.
Yôhanes	43	14	15	“Ibale ni ngwés me, n’a tééda mambén mem.
Yôhanes	43	14	16	Ndi m’a bat Tata le a ti bé nhôla numpe nu a’ ba lôñni bé i boga ni boga,
Yôhanes	43	14	17	mbuu u maliga, u nkoñ ’isi u nla bé kôhna inyule u ntehe bé wo, u nyi bé to wo. Ndi bé ni nyi wo inyule u nyén ni bé, u yé ki ikété nan.
Yôhanes	43	14	18	M’a yék bé me bé bébotama. M’a lo i bééni.
Yôhanes	43	14	19	Ndék ngéda, nkoñ ’isi w’a tehe ha bé me, ndi bé n’a tehe me inyule me niñ, yak bé n’a niñ.
Yôhanes	43	14	20	I yokel nu nyen n’a yi le me yé ikété adna ni Tata, yak bé ni yé ikété adna ni me; me ki me yé ikété adna ni bé.
Yôhanes	43	14	21	Nu ni nu a gwé mambén mem, a téédaga ki mo, nyen a ngwés me. Yak nu ni nu a ngwés me, Tata ki a’ gwés nye; yak me m’a gwés nye, m’a boñ ki le a tibil yaga yi me.”
Yôhanes	43	14	22	Yuda, ndi ha Iskariôt bé, a kal nye le: “A Nwet, inyuki u mboñ le bés di tibil yi we, ndi ha bôt ba nkoñ ’isi bé?”
Yôhanes	43	14	23	Yésu a timbhe, a kal nye le: “Ibale mut a ngwés me, a’ tééda bañga yem, yak Tata a’ gwés nye, di ga lo i nyeni, di bana ki liyééne lôñni nye.
Yôhanes	43	14	24	Nu ni nu a ngwés bé me, a ntééda bé bibañga gwem. I bañga ni yé i nok i ta bé yem, ndi i yé i Tata nu a bi ep me.
Yôhanes	43	14	25	“Me bi kal bé i mam mana ngéda me bé me ngi yii ni bé.
Yôhanes	43	14	26	Ndi nhôla le mbuu mpubi, u Tata a’ ep i jôl jem, nyen a’ niiga bé mam momasôna, a hôñlaha ki bé i mam momasôna me bi kal bé.
Yôhanes	43	14	27	Me nyigle bé nsañ, me nti bé nsañ wem. Me nti bé bé wo kiki nkoñ ’isi u nti wo. Miñem minan mi siida bañ, ni sehla bañ to ni woñi.
Yôhanes	43	14	28	Ni bi nok i jam me bi kal bé le: ‘Me nke, ndi m’a témb me lo i bééni.’ Ibale ni ngwés toi me, n’a kon maséé le me nke yak Tata, inyule Tata a nloo me.
Yôhanes	43	14	29	Jon hanano, me mal kal bé jo ilole li mbôña, inyu boñ le ni hémle ngéda l’a bôña toi.
Yôhanes	43	14	30	M’a pot ha bé ngandak ni bé, inyule ñane nkoñ ’isi a yé i lo, ndi a ñénél bé me.
Yôhanes	43	14	31	Ndi inyu boñ le nkoñ ’isi u yi le me ngwés Tata, me mboñ mam ndik kiki Tata a bi ti me oda le me boñ. Telbana, di kenek.
book	book_id	chapter	verse	text
Yôhanes	43	15	1	“Men me yé bañga nkôô wai, Tata nyen a yé nsalnwom.
Yôhanes	43	15	2	A nkit hiki ntjep wem u u num bé matam, ndi a mpubus hiki ntjep u u num matam le ndi u num matam iloo ha.
Yôhanes	43	15	3	Bé ni mal ba mapubi ni njel bañga me bi kal bé.
Yôhanes	43	15	4	Ni téñbe i ba ikété adna ni me, yak me m’a téñbe i ba ikété adna ni bé. Kiki ntjep u nla bé num matam wotama ibale u édi ha bé ni nkôô wai, hala nyen to bé ni nla bé num matam ibale ni ntéñbe bé i ba ikété adna ni me.
Yôhanes	43	15	5	Men me yé nkôô wai; bé ni yé mintjep. Nu ni nu a ntéñbe i ba ikété adna ni me, yak me me ntéñbe i ba ikété adna ni nye, nyen a num ngandak matam; inyule handugi me, ni nla bé boñ to jam.
Yôhanes	43	15	6	Ibale mut a ntéñbe bé i ba ikété adna ni me, a mba kiki ntjep le ba nkit, ndi u kôt. I mbus, bôt ba nkot i mintjep mi, ba leñ nwo i hié, mi lék.
Yôhanes	43	15	7	Ibale ni ntéñbe i ba ikété adna ni me, ndi yak bibañga gwem bi yéglege ikété nan, ha nyen ngéda ni mbat kii yosôna ni gwé ngôñ, y’a bôña inyu nan.
Yôhanes	43	15	8	Tata a nkôhna lipém munu jam lini le, ni ke ni bisu i num ngandak matam, ni unda ki le ni yé banigil bem.
Yôhanes	43	15	9	Ndik kiki Tata a bi gwés me, hala nyen yak me me bi gwés bé; yéna ikété gwéha yem.
Yôhanes	43	15	10	Ibale ni ntééda mambén mem, n’a yén ikété gwéha yem, kiki yak me me bi tééda mambén ma Tata, me yén ki ikété gwéha yé.
Yôhanes	43	15	11	“Me bi kal bé i mam mana, inyu boñ le ni bana maséé mem, yak bé ni yon ni maséé.
Yôhanes	43	15	12	Mbén yem ini le, ni gwéhna bé ni bé kiki me bi gwés bé.
Yôhanes	43	15	13	Mut to wada a gwé bé gwéha i nloo ini, le mut a ti niñ yé inyu mawanda mé.
Yôhanes	43	15	14	Ni yé mawanda mem ibale ni mboñ i mam me nkal bé.
Yôhanes	43	15	15	Me nsébél ha bé bé le minkol inyule nkol u nyi bé i jam nwet wé a mboñ. Ndi me nsébél bé le mawanda mem, inyule me bi yis bé mam momasôna me bi nok yak Tata.
Yôhanes	43	15	16	Bé bé bon ni bi pohol me, ndi men me bi pohol bé, me téé ki bé le ni ke, ni kônde ki num matam, ni le matam manan ma nom, le ndi to kii ni mbat Tata i jôl jem, a ti bé jo.
Yôhanes	43	15	17	“Me nti bé oda inyu mam mana le ndi ni gwéhna bé ni bé.
Yôhanes	43	15	18	Ibale nkoñ ’isi u ñoo bé, ni nyi le u bi oo me ilole u ñoo bé.
Yôhanes	43	15	19	Ibale ni bak bôt ba nkoñ ’isi, ki nkoñ ’isi u ngwés bé inyule ni yé bôt bé. Kiki ni ta bé bôt ba nkoñ ’isi, ndi le me mpohol bé ikété nkoñ ’isi, inyu hala nyen nkoñ ’isi u ñoo bé.
Yôhanes	43	15	20	Ni tééda ikété mahoñol i bañga me bi kal bé le, nkol u nloo bé nwet wé. Ibale ba bi tééñga me, b’a tééñga yak bé; ibale ba bi tééda bañga yem, b’a tééda yak bañga nan.
Yôhanes	43	15	21	Ndi b’a boñ i mam mana momasôna inyu kolba bé hala kiki ni yé banigil bem, inyule ba nyi bé Nu a bi ep me.
Yôhanes	43	15	22	Ibale me lo bé le me pôdôs bo, ki ba gwé bé béba. Ndi nano ba gwé bé nwéhél inyu béba yap.
Yôhanes	43	15	23	Nu ni nu a ñoo me, wee a ñoo yak Tata.
Yôhanes	43	15	24	Ibale me boñ bé minson ipôla yap le mut numpe a bi boñ bé, ki ba gwé bé béba; ndi nano ba bi tehe me, ba oo me, ba oo yak Tata.
Yôhanes	43	15	25	Ndi hala a bi bôña inyu yônôs bañga i yé ntilga ikété mbén Môsi le: ‘Ba bi oo me yañga.’
Yôhanes	43	15	26	I ngéda nhôla a’ lo, nu m’a ômle bé, a lôlak yak Tata, mbuu u maliga u u nlôl yak Tata, nyen a’ bok mbôgi inyu yem;
Yôhanes	43	15	27	ndi yak bé ni nlama bok mbôgi, inyule ni bi ba lôñni me ibôdôl i bibôdle.
book	book_id	chapter	verse	text
Yôhanes	43	16	1	“Me ñañle bé i mam mana le ndi ni baage bañ.
Yôhanes	43	16	2	Bôt b’a pémés bé i ndap bibégés. Ni maliga, ngeñ i yé i lo le ngéda mut a’ nol bé, a’ hoñol le a ngwel nson mpubhaga inyu Nyambe.
Yôhanes	43	16	3	Ndi b’a boñ i mam mana inyule ba bi pam bé i yi to Tata, to me.
Yôhanes	43	16	4	Ndi me bi añle bé i mam mana kayéle ngéda ngeñ i nkola le ma bôña, ni bigda le me bi añle bé mo. “Me bi bôk bé ndugi me añle bé mo, inyule me bé lôñni bé.
Yôhanes	43	16	5	Ndi hanano me nke yak Nu a bi ep me; ndi to wada ikété nan a mbat bé me le: ‘Hee u nke?’
Yôhanes	43	16	6	Ndi inyule me ñañle bé i mam mana, ndutu i nyon bé i miñem.
Yôhanes	43	16	7	Ndi me nkal bé maliga le, i yé loñge inyu nan le me ke. Inyule ibale me nke bé, ki nhôla a’ lo bé i bééni; ndi ibale me nke, m’a ômle bé nye.
Yôhanes	43	16	8	Ndi ngéda a’ lo, a’ tibil unda bôt bobasôna kii i yé béba, kii i yé telepsép, ni kii i yé bikééhene bi Nyambe:
Yôhanes	43	16	9	Jam li bisu inyu béba, inyule ba ñunda bé le ba nhémle me;
Yôhanes	43	16	10	i mbus inyu telepsép, inyule me nke yak Tata, ni le n’a tehe ha bé ki me;
Yôhanes	43	16	11	sôk i nsôk inyu bikééhene, inyule ñane nkoñ ’isi unu a mal kôhna mbagi yé.
Yôhanes	43	16	12	“Me ngi gwé ngandak mam i kal bé, ndi ni nla bé begee mo nano.
Yôhanes	43	16	13	Ndi ngéda a’ lo, hala wee mbuu u maliga, a’ éga bé ikété maliga momasôna, inyule a’ pot bé ni nyemede, ndi i jam a nok jon a’ pot, a’ kal ki bé i mam ma nlo.
Yôhanes	43	16	14	Nyen a’ ti me lipém inyule a’ añle bé i mam a nôgôl i meeni.
Yôhanes	43	16	15	I mam momasôna Tata a gwé ma yé mem. Inyu hala nyen me bi kal bé le a’ añle bé i mam a nôgôl i meeni.
Yôhanes	43	16	16	Ndék ngéda n’a tehe ha bé me, ndi ndék ngéda ki n’a témb ni tehe me.”
Yôhanes	43	16	17	Ha nyen bahogi ikété banigil bé ba bi kalna le: “Kii a nyéñ kal ngéda a nkal bés le: ‘Ndék ngéda n’a tehe ha bé me, ndi ndék ngéda ki n’a témb ni tehe me,’ ni le: ‘Inyule me nke yak Tata’?”
Yôhanes	43	16	18	Jon ba bé kal le: “Kii a nyéñ kal ngéda a mpot le: ‘Ndék ngéda’? Di nok bé i jam a mpot.”
Yôhanes	43	16	19	Yésu a bi yi le ba nsômbôl bat nye mbadga, jon a bi kal bo le: “Baa ni mbadna mambadga munu jam lini inyule me nkal le: ‘Ndék ngéda n’a tehe ha bé ki me, ndi ndék ngéda n’a témb ki ni tehe me?’
Yôhanes	43	16	20	Me nkal yaga bé maliga le, n’a ee, ni bégél ki, ndi nkoñ ’isi w’a kon maséé; n’a nok ndutu, ndi ndutu nan y’a yila maséé.
Yôhanes	43	16	21	I ngéda muda a yé ikété nkôôga, a nok ndutu inyule ngéda yé i nkola, ndi ngéda a mal gwal man, a nhoñol ha bé njiiha inyule a yé maséé le mut a ngwéé i nkoñ ’isi.
Yôhanes	43	16	22	Nlélém ni bé, nano ni gwé ndutu; ndi d’a témb di tehna, ha nyen miñem minan nw’a kon maséé, mut to wada a’ kadal bé bé maséé manan.
Yôhanes	43	16	23	I kel i, n’a bat bé me mbadga yo ki yo. Me nkal yaga bé maliga le, to kinje jam ni mbat Tata, a’ ti bé jo i jôl jem.
Yôhanes	43	16	24	Letee ni nano, ni mbadak bé jam to jada i jôl jem. Ni bat, ndi n’a kôhna, le ndi maséé manan ma ba nyonok.
Yôhanes	43	16	25	“Me bi gwélél ngén inyu kal bé i mam mana. Ngeñ i nlo le m’a gwélél ha bé ngén inyu pôdôs bé, ndi m’a tibil yaga toñle bé njee a yé Tata.
Yôhanes	43	16	26	I kel i, n’a bat Tata mam i jôl jem; i ngéda me mpot hala, me nsômbôl bé kal le men m’a bat Tata mam inyu nan.
Yôhanes	43	16	27	Inyule Tata nyemede a ngwés bé, inyule ni bi gwés me, ni hémle ki le me yé nlegelnwin nu a bi lôl yak Nyambe.
Yôhanes	43	16	28	Me bi lo munu nkoñ ’isi kiki nlegelnwin nu Tata. Nano me yé i nyodi i nkoñ ’isi, me nke yak Tata.”
Yôhanes	43	16	29	Banigil bé ba kal le: “Nun-ki, nano u yé yaga i tibil toñle bés mam, u ngwélél ha bé ngén.
Yôhanes	43	16	30	Nano di nyi le u nyi mam momasôna, u gwé bé to ngôñ le mut a bat we mbadga. Inyu hala nyen di nhémle le u bi lôl yak Nyambe.”
Yôhanes	43	16	31	Yésu a timbhe bo le: “Baa nano nyen ni nhémle?
Yôhanes	43	16	32	Nuna-ki, ngeñ i yé i lo, yak lo i mal lo, le b’a sand bé, hiki wada nan a ôt ngwéé i mbai yé, ni yék ki me metama. Ndi me ta bé metama, inyule Tata a yé lôñni me.
Yôhanes	43	16	33	Me nkal bé i mam mana inyu boñ le ni njel yem ni bana nsañ. N’a bana njiiha ikété nkoñ ’isi, ndi ni bana ñem ngui! Me bi yémbél nkoñ ’isi.”
book	book_id	chapter	verse	text
Yôhanes	43	17	1	I ngéda Yésu a bi mal pot i mam mana, a pa mis i ngii, a kal le: “A Ta, ngeñ i nkola. Ti man woñ lipém inyu boñ le man woñ a ti we lipém,
Yôhanes	43	17	2	ndik kiki u bi ti nye kunde i ngii minsôn nwominsôna le ndi a ti bôt bobasôna u bi ti nye niñ boga.
Yôhanes	43	17	3	I jam lini jon li nkena i niñ boga, le ba pam i yi we, bañga mpom Nyambe wada, ni nu u bi ep le Yésu Kristô.
Yôhanes	43	17	4	Me bi ti we lipém hana ’isi, me mélés ki nson u bi ti me le me boñ.
Yôhanes	43	17	5	Jon nano, a Ta, ti me lipém ipañ yoñ, kiki me bééna lipém ipañ yoñ nkoñ ’isi wo ngi ba.
Yôhanes	43	17	6	“Me bi boñ le jôl joñ li yiba ni bôt u bi ti me ikété nkoñ ’isi. Ba bé bôt boñ, ndi u bi ti me bo, ba tééda ki bañga yoñ.
Yôhanes	43	17	7	Nano ba mpam i yi le mam momasôna u bi ti me ma nlôl i weeni;
Yôhanes	43	17	8	inyule me bi ti bo bibañga u bi ti me, ba neebe gwo, ba pam ki i yi ibabé pééna le me bi lo i jôl joñ, ba hémle yak le wen u bi ep me.
Yôhanes	43	17	9	Me nsoohe inyu yap; me nsoohe bé inyu nkoñ ’isi, ndi inyu bôt u bi ti me, inyule ba yé bôt boñ;
Yôhanes	43	17	10	mam mem momasôna ma yé moñ, yak mam moñ ma yé mem, me bi kôhna ki lipém ipôla yap.
Yôhanes	43	17	11	“Me ta ha bé hana nkoñ ’isi, ndi bo ba ngi yii hana nkoñ ’isi, ndi me yé i lo i weeni. A Ta Numpubi, tééda bo inyu jôl joñ jomede li u bi ti me inyu boñ le ba ba wada, ndik kiki me ni we di yé wada.
Yôhanes	43	17	12	I ngéda me bé lôñni bo, me bé tééda bo inyu jôl joñ u bi ti me; me bi sôñ ki bo, to wada ikété yap a bi tjiba bé, handugi man nu tjiba, le ndi tilna i yon.
Yôhanes	43	17	13	Ndi nano me yé i lo i weeni, me nkal ki mam mana i nkoñ ’isi, le ndi ba bana maséé mem nyoñok ikété yap.
Yôhanes	43	17	14	Me bi ti bo bañga yoñ, ndi nkoñ ’isi u bi oo bo, inyule ba ta bé bôt ba nkoñ ’isi, kiki to me me ta bé mut nkoñ ’isi.
Yôhanes	43	17	15	“Me mbat bé le u héya bo ikété nkoñ ’isi, ndi le u sôñ bo i moo ma mut mbe.
Yôhanes	43	17	16	Ba ta bé bôt ba nkoñ ’isi, kiki me ta bé mut nkoñ ’isi.
Yôhanes	43	17	17	Yilha bo bapubhaga ni njel maliga; bañga yoñ i yé maliga.
Yôhanes	43	17	18	Yak me me ñep bo ikété nkoñ ’isi, ndik kiki u bi ep me ikété nkoñ ’isi.
Yôhanes	43	17	19	Me yé ki i tééda memede mpubi inyu yap, le ndi yak bo ba yila bapubhaga ni njel maliga.
Yôhanes	43	17	20	“Me nsoohe bé ndik inyu yap botama, ndi me nsoohe Yak inyu bôt b’a hémle me ni njel bañga yap,
Yôhanes	43	17	21	inyu boñ le bobasôna ba ba wada, kiki we a Ta, u yé ikété adna ni me, yak me me yé ikété adna ni we, kayéle yak bo ba ba ikété adna ni bés, le ndi nkoñ ’isi u hémle le wen u bi ep me.
Yôhanes	43	17	22	Me bi ti bo lipém u bi ti me kayéle ba ba wada ndik kiki di yé wada.
Yôhanes	43	17	23	Me yé ikété adna ni bo, yak we u yé ikété adna ni me, le ndi ba ba wada i nya i yôni inyu boñ le nkoñ ’isi u yi le u bi ep me, ni le u bi gwés bo nlélém kiki u bi gwés me.
Yôhanes	43	17	24	A Ta, me nsômbôl le i bôt u bi ti me ba ba lôñni me i homa me yé, le ndi ba tehe lipém jem li u bi ti me, inyule u bi gwés me ilole nkoñ ’isi u mbôdôl.
Yôhanes	43	17	25	A Ta nu a téé sép, nkoñ ’isi u mpam yaga bé i yi we, ndi me me nyi we, yak bana ba mpam i yi le wen u bi ep me.
Yôhanes	43	17	26	Me bi boñ le ba yi jôl joñ, m’a kônde ki boñ le li yiba, le ndi gwéha u bi gwés me, yak bo ba unda yo bape, me bak ki ikété adna ni bo.”
book	book_id	chapter	verse	text
Yôhanes	43	18	1	Kiki a mal pot i mam mana, Yésu a pam ni banigil bé inyu ke ii pes i nsôsôgô u Kidrôn, i homa wom mbônji u bééne, nye ni banigil bé ba jôp mukété.
Yôhanes	43	18	2	Ndi yak Yuda, nu a bi liibana nye, a bé yi i homa nu, inyule Yésu a bééna lem i bomna ni banigil bé nyoo.
Yôhanes	43	18	3	Jon Yuda a bi lona ntôñ bisônda ni batat ba ba bé lôl yak baéga biprisi lôñni Farisai; ba lo ha ni nwai lôñni bilambe, yak ni bijôl bi gwét.
Yôhanes	43	18	4	Ndi kiki Yésu a bé yi mam momasôna ma bé lama pémél nye, a telep bo bisu, a kal bo le: “Njee ni nyéñ?”
Yôhanes	43	18	5	Ba timbhe nye le: “Yésu, mut Nasaret.” A kal bo le: “Me nunu.” Yak Yuda, nu a bi liibana nye, a bé a téé ha lôñni bo.
Yôhanes	43	18	6	Ndi ngéda Yésu a bi kal bo le: “Me nunu,” ba témb ni mbus, ba kwo ’isi.
Yôhanes	43	18	7	Jon a bi témb a bat bo le: “Njee ni nyéñ?” Ba kal le: “Yésu, mut Nasaret.”
Yôhanes	43	18	8	Yésu a timbhe le: “Me nkal bé le me nunu. Jon ibale me nyen ni nyéñ, nwaha bana bôt ba kenek.”
Yôhanes	43	18	9	Hala a bé inyu yônôs jam a bi kal le: “Ikété bôt u bi ti me, me nimis bé to wada.”
Yôhanes	43	18	10	Ndi Simôn Pétrô a bééna pansoñ, ha nyen a bi sodol yo, a kek nkol u prisi keñi, a kit wo ôô walôm. Jôl li nkol u li bé le Malkus.
Yôhanes	43	18	11	Ndi Yésu a kal Pétrô le: “Som pansoñ i sogoo yé. Baa me nlama bé nyo libôndô Tata a bi ti me?”
Yôhanes	43	18	12	Ha nyen bisônda ni ñane hikôô hi bisônda lôñni batat ba Lôk Yuda ba gwel Yésu, ba kañ nye.
Yôhanes	43	18	13	Ba bôk ndugi ba kena nye yak Ana, inyule a bé nkil Kaifa nu a bé prisi keñi mu nwii u.
Yôhanes	43	18	14	Kaifa yaga nyen a bi ti Lôk Yuda pék le i yé nseñ le mut wada a wo inyu litén.
Yôhanes	43	18	15	Ndi Simôn Pétrô a bé noñ Yésu lôñni nnigil numpe. Prisi keñi i bé yi i nnigil nu, jon nnigil nu a bi jôp lôñni Yésu ikété kotoo i ndap prisi keñi,
Yôhanes	43	18	16	ndi Pétrô a bé a téé ha i mbégdé, ipañ nwemel. Ha nyen nunu nnigil numpe, nu prisi keñi i bé yi, a pam i mbégdé, a pôdôs hingonda hi bé tat nwemel; i mbus, a jôbna Pétrô.
Yôhanes	43	18	17	Ndi hingonda hi hi bé tat nwemel hi bat Pétrô le: “Baa yak we u yé yaga wada ikété banigil ba mut nunu?” A kal le: “Me ta bé wada wap.”
Yôhanes	43	18	18	Ndi minkol ni batat ba bé ba téé ha ipañ hié hi makalak ba bi koda, inyule lihep li bé, ba nohbak hié. Yak Pétrô a bé a téé ha lôñni bo, a nohbak hié.
Yôhanes	43	18	19	Ha nyen ñéga biprisi a bi bat Yésu mambadga inyu banigil bé ni inyu biniigana gwé.
Yôhanes	43	18	20	Yésu a timbhe nye le: “Me bi pôdôs nkoñ ’isi i mbamba. Me bé niiga hiki ngéda i ndap bibégés ni i témpel, i homa Lôk Yuda yôsôna i nkodba, me bi pot bé jam jo ki jo bisôsôli.
Yôhanes	43	18	21	Inyuki u mbat me mambadga? Bat i bôt ba bi emble i mam me bi añle bo. Nun-ki, bon ba nyi i mam me bi pot.”
Yôhanes	43	18	22	I ngéda a bi mal pot i mam mana, ntat wada nu a bé a téé ha, a kôt Yésu libai i su, a kal le: “Baa hala nyen u ntimbhe ñéga biprisi?”
Yôhanes	43	18	23	Yésu a timbhe nye le: “Ibale me mpot jam libe, kal me i béba jam me mpot; ndi ibale i jam me mpot li téé, inyuki u mbép me?”
Yôhanes	43	18	24	I mbus, Ana a ep nye yak prisi keñi le Kaifa; Yésu a bé a ngi yii nkañak.
Yôhanes	43	18	25	Ndi Simôn Pétrô a bé a téé ha, a nohbak hié. Ha nyen ba bi kal nye le: “Baa yak we u yé nga wada ikété banigil bé?” A tañ, a kal le: “Me ta bé wada wap.”
Yôhanes	43	18	26	Wada ikété minkol mi prisi keñi, nu a bé ikété lihaa li mut Pétrô a bi kit ôô, a kal le: “Baa me ntehe nga we lôñni nye i wom mbônji?”
Yôhanes	43	18	27	Ndi Pétrô a témb a tañ; ha nlélém ngéda, nlôm kôp a oñ.
Yôhanes	43	18	28	I mbus, ba nyodna Yésu yak Kaifa inyu kena nye i ndap ngomin keñi. Hala a bé kegla tutu. Ndi bomede ba bi jôp bé i ndap ngomin le ba hindis bañ bomede, inyule ba bé yéñ je Pasa.
Yôhanes	43	18	29	Ha nyen Pilatô a bi pam i mbégdé, a boma bo, a kal le: “Umbe nsohi ni ñôm mut nunu?”
Yôhanes	43	18	30	Ba timbhe nye le: “Ibale i mut nunu a bak bé mboñbéba, ki di nti bé we nye.”
Yôhanes	43	18	31	Ha nyen Pilatô a bi kal bo le: “Bébomede yoña nye, ni kéés nye inoñnaga ni mbén nan.” Lôk Yuda i kal nye le: “I ta bé bés kunde i nol mut nye ki nye.”
Yôhanes	43	18	32	Hala a bé inyu yônôs i bañga Yésu a bi pot inyu toñol umbe ntén nyemb a bé bebee ni kôhna.
Yôhanes	43	18	33	Jon Pilatô a bi témb a jôp i ndap ngomin keñi, a sébél Yésu, a bat nye le: “Baa u yé Kiñe Lôk Yuda?”
Yôhanes	43	18	34	Yésu a timbhe le: “Baa u mbat hala inyule wemede u ngwés toi yi, tole inyule u nok bôt bape ba mpot hala inyu yem?”
Yôhanes	43	18	35	Pilatô a timbhe le: “Baa me yé man Lôk Yuda? Litén joñ jomede lôñni baéga biprisi bon ba nti me we. Kii u bi boñ?”
Yôhanes	43	18	36	Yésu a timbhe le: “Ane yem i ta bé i nkoñ ’isi unu. Ibale Ane yem i bak i nkoñ ’isi unu, ki bagwélél bem ba njo, le ba ti bañ me i moo ma Lôk Yuda. Ndi ni maliga, Ane yem i nlôl bé munu nkoñ ’isi unu.”
Yôhanes	43	18	37	Jon Pilatô a kal nye le: “Wee u yé ni kiñe?” Yésu a timbhe le: “Wemede nyen u yé i kal le me yé kiñe. Inyu jam lini nyen me bi gwéé, inyu jam lini ki nyen me bi lo hana nkoñ ’isi, le me bok mbôgi inyu maliga. Hiki mut a yé i pes i maliga a ñemble kiñ yem.”
Yôhanes	43	18	38	Pilatô a kal nye le: “Kii i yé maliga?” Kiki a mal pot hala, a témb a pam inyu boma Lôk Yuda, a kal bo le: “Me nléba bé nye nsohi wo ki wo.
Yôhanes	43	18	39	Handugi hala, ni gwé lem le me nlama pémhene bé mut mok wada i ngand Pasa. Baa ni ngwés ni le me pémhene bé Kiñe Lôk Yuda?”
Yôhanes	43	18	40	Ba témb ba lond le: “Ha i mut nunu bé, pémhene bés Barabas!” Ndi Barabas a bé ntonba.
book	book_id	chapter	verse	text
Yôhanes	43	19	1	I mbus, Pilatô a yoñ Yésu, a bép nye disôô.
Yôhanes	43	19	2	Bisônda bi bañ ntut biloo, bi ha wo i ño wé, bi ha ki nye mbôñgô mbot wedewede,
Yôhanes	43	19	3	bi bé waa bé lo ipañ yé, bi kalak nye le: “Di nyéga, a Kiñe Lôk Yuda!” Bi bé kôt ki nye mabai i su ibabé waa.
Yôhanes	43	19	4	Pilatô a témb a pam i mbégdé, a kal bo le: “Nuna-ki, me mpamna nye i mbégdé inyu nan kayéle ni yi le me nléba bé nye nsohi wo ki wo.”
Yôhanes	43	19	5	Ha nyen Yésu a bi pam, a bak a hééba ntut biloo ni mbôñgô mbot wedewede. Pilatô a kal bo le: “Nuna-ki, nye nunu!”
Yôhanes	43	19	6	Ndi ngéda biprisi bikeñi ni batat ba bi tehe nye, ba lond le: “Péni nye i kék! Péni nye i kék!” Pilatô a kal bo le: “Bébomede yoña nye, nola nye, inyule me nléba bé nye nsohi wo ki wo.”
Yôhanes	43	19	7	Lôk Yuda i timbhe nye le: “Di gwé mbén, inoñnaga ni mbén i, a nlama wo inyule a nkadba le a yé man Nyambe.”
Yôhanes	43	19	8	I ngéda Pilatô a bi nok i jam ba bé kal, a kônde kon woñi,
Yôhanes	43	19	9	a témb a jôp i ndap ngomin keñi, a kal Yésu le: “U nlôl hee?” Ndi Yésu a bi timbhe bé nye.
Yôhanes	43	19	10	Ha nyen Pilatô a bi kal nye le: “Baa u ntjél timbhe me? Baa u nyi bé le me gwé kunde i nwas we, me gwé ki kunde i nol we?”
Yôhanes	43	19	11	Yésu a timbhe nye le: “U bak bé le u bana kunde yo ki yo i ngii yem, handugi le i lôl we i ngii. Jon i mut a nti we me a gwé béba i nlôôha keñi.”
Yôhanes	43	19	12	Inyu hala nyen Pilatô a bi waa bé yéñ njel i nwas nye, ndi Lôk Yuda i bé lond le: “Ibale u nwas i mut nunu, u ta bé liwanda li Kaisa. Hiki mut nu a nkal le a yé kiñe, a nkolba Kaisa.”
Yôhanes	43	19	13	Kiki Pilatô a nok bibañga bini, a kena Yésu i mbégdé, a yén i yééne bikééhene i homa ba nsébél le Mbégdé i ntegek ngok, ndi Gabata ni hop Lôk Héber.
Yôhanes	43	19	14	Ndi kel i, i bé kel ngôôba i ngand Pasa; hala a bé jam kiki bo kosi. Ha nyen a bi kal Lôk Yuda le: “Nuna-ki, kiñe nan ini!”
