book	book_id	chapter	verse	text
Luke	42	8	23	But as they were sailing he fell asleep. Now a violent windstorm descended upon the lake, and they began to fill up with water and to be in danger.
Luke	42	8	24	Finally they went to him and roused him, saying: “Instructor, Instructor, we are about to perish!” Rousing himself, he rebuked the wind and the raging of the water, and they subsided, and a calm set in.
Luke	42	8	25	Then he said to them: “Where is YOUR faith?” But struck with fear, they marveled, saying to one another: “Who really is this, for he orders even the winds and the water, and they obey him?”
Luke	42	8	26	And they put in to shore in the country of the Gerasenes, which is on the side opposite Galilee.
Luke	42	8	27	But as he got out onto land a certain man from the city who had demons met him. And for a considerable time he had not worn clothing, and he was staying, not at home, but among the tombs.
Luke	42	8	28	At the sight of Jesus he cried aloud and fell down before him, and with a loud voice he said: “What have I to do with you, Jesus Son of the Most High God? I beg you, do not torment me.”
Luke	42	8	29	(For he had been ordering the unclean spirit to come out of the man. For over a long time it had held him fast, and he was repeatedly bound with chains and fetters under guard, but he would burst the bonds and be driven by the demon into the lonely places.)
Luke	42	8	30	Jesus asked him: “What is your name?” He said: “Legion,” because many demons had entered into him.
Luke	42	8	31	And they kept entreating him not to order them to go away into the abyss.
Luke	42	8	32	Now a herd of a considerable number of swine was feeding there on the mountain; so they entreated him to permit them to enter into those. And he gave them permission.
Luke	42	8	33	Then the demons went out of the man and entered into the swine, and the herd rushed over the precipice into the lake and drowned.
Luke	42	8	34	But when the herders saw what had happened, they fled and reported it to the city and to the countryside.
Luke	42	8	35	Then people turned out to see what had happened, and they came to Jesus and found the man from whom the demons came out, clothed and in his sound mind, sitting at the feet of Jesus; and they became fearful.
Luke	42	8	36	Those who had seen it reported to them how the demon-possessed man had been made well.
Luke	42	8	37	So all the multitude from the surrounding country of the Gerasenes asked him to get away from them, because they were in the grip of great fear. Then he went aboard the boat and turned away.
Luke	42	8	38	However, the man from whom the demons had gone out kept begging to continue with him; but he dismissed the man, saying:
Luke	42	8	39	“Be on your way back home, and keep on relating what things God did for you.” Accordingly he went away, proclaiming throughout the whole city what things Jesus did for him.
Luke	42	8	40	When Jesus got back, the crowd received him kindly, for they were all expecting him.
Luke	42	8	41	But, look! a man named Jairus came, and this man was a presiding officer of the synagogue. And he fell at the feet of Jesus and began to entreat him to enter into his house,
Luke	42	8	42	because he had an only-begotten daughter about twelve years old and she was dying. As he was going the crowds thronged him.
Luke	42	8	43	And a woman, subject to a flow of blood for twelve years, who had not been able to get a cure from anyone,
Luke	42	8	44	approached from behind and touched the fringe of his outer garment, and instantly her flow of blood stopped.
Luke	42	8	45	So Jesus said: “Who was it that touched me?” When they were all denying it, Peter said: “Instructor, the crowds are hemming you in and closely pressing you.”
Luke	42	8	46	Yet Jesus said: “Someone touched me, for I perceived that power went out of me.”
Luke	42	8	47	Seeing that she had not escaped notice, the woman came trembling and fell down before him and disclosed before all the people the cause for which she touched him and how she was healed instantly.
Luke	42	8	48	But he said to her: “Daughter, your faith has made you well; go your way in peace.”
Luke	42	8	49	While he was yet speaking, a certain representative of the presiding officer of the synagogue came, saying: “Your daughter has died; do not bother the teacher any longer.”
Luke	42	8	50	On hearing this, Jesus answered him: “Have no fear, only put forth faith, and she will be saved.”
Luke	42	8	51	When he reached the house he did not let anyone go in with him except Peter and John and James and the girl’s father and mother.
Luke	42	8	52	But people were all weeping and beating themselves in grief for her. So he said: “STOP weeping, for she did not die but is sleeping.”
Luke	42	8	53	At this they began to laugh at him scornfully, because they knew she had died.
Luke	42	8	54	But he took her by the hand and called, saying: “Girl, get up!”
Luke	42	8	55	And her spirit returned, and she rose instantly, and he ordered something to be given her to eat.
Luke	42	8	56	Well, her parents were beside themselves; but he instructed them to tell no one what had happened.
book	book_id	chapter	verse	text
Luke	42	9	1	Then he called the twelve together and gave them power and authority over all the demons and to cure sicknesses.
Luke	42	9	2	And so he sent them forth to preach the kingdom of God and to heal,
Luke	42	9	3	and he said to them: “Carry nothing for the trip, neither staff nor food pouch, nor bread nor silver money; neither have two undergarments.
Luke	42	9	4	But wherever YOU enter into a home, stay there and leave from there.
Luke	42	9	5	And wherever people do not receive YOU, on going out of that city shake the dust off YOUR feet for a witness against them.”
Luke	42	9	6	Then starting out they went through the territory from village to village, declaring the good news and performing cures everywhere.
Luke	42	9	7	Now Herod the district ruler heard of all the things happening, and he was in great perplexity because of its being said by some that John had been raised up from the dead,
Luke	42	9	8	but by others that Elijah had appeared, but by still others that a certain one of the ancient prophets had risen.
Luke	42	9	9	Herod said: “John I beheaded. Who, then, is this about whom I am hearing such things?” So he was seeking to see him.
Luke	42	9	10	And when the apostles returned they recounted to him what things they had done. With that he took them along and withdrew to privacy into a city called Bethsaida.
Luke	42	9	11	But the crowds, getting to know it, followed him. And he received them kindly and began to speak to them about the kingdom of God, and he healed those needing a cure.
Luke	42	9	12	Then the day started to decline. The twelve now came up and said to him: “Dismiss the crowd, that they may go into the villages and countryside round about and procure lodging and find provisions, because out here we are in a lonely place.”
Luke	42	9	13	But he said to them: “YOU give them something to eat.” They said: “We have nothing more than five loaves and two fishes, unless perhaps we ourselves go and buy foodstuffs for all these people.”
Luke	42	9	14	They were, in fact, about five thousand men. But he said to his disciples: “Have them recline as at meals, in groups of about fifty each.”
Luke	42	9	15	And they did so and had them all recline.
Luke	42	9	16	Then taking the five loaves and the two fishes, he looked up to heaven, blessed them and broke them up and began to give them to the disciples to set before the crowd.
Luke	42	9	17	So they all ate and were satisfied, and the surplus that they had was taken up, twelve baskets of fragments.
Luke	42	9	18	Later, while he was praying alone, the disciples came together to him, and he questioned them, saying: “Who are the crowds saying that I am?”
Luke	42	9	19	In reply they said: “John the Baptist; but others, Elijah, and still others, that one of the ancient prophets has risen.”
Luke	42	9	20	Then he said to them: “YOU, though, who do YOU say I am?” Peter said in reply: “The Christ of God.”
Luke	42	9	21	Then in a stern talk to them he instructed them not to be telling this to anybody,
Luke	42	9	22	but said: “The Son of man must undergo many sufferings and be rejected by the older men and chief priests and scribes, and be killed, and on the third day be raised up.”
Luke	42	9	23	Then he went on to say to all: “If anyone wants to come after me, let him disown himself and pick up his torture stake day after day and follow me continually.
Luke	42	9	24	For whoever wants to save his soul will lose it; but whoever loses his soul for my sake is the one that will save it.
Luke	42	9	25	Really, what does a man benefit himself if he gains the whole world but loses his own self or suffers damage?
Luke	42	9	26	For whoever becomes ashamed of me and of my words, the Son of man will be ashamed of this one when he arrives in his glory and that of the Father and of the holy angels.
Luke	42	9	27	But I tell YOU truthfully, There are some of those standing here that will not taste death at all until first they see the kingdom of God.”
Luke	42	9	28	In actual fact, about eight days after these words, he took Peter and John and James along and climbed up into the mountain to pray.
Luke	42	9	29	And as he was praying the appearance of his face became different and his apparel became glitteringly white.
Luke	42	9	30	Also, look! two men were conversing with him, who were Moses and Elijah.
Luke	42	9	31	These appeared with glory and began talking about his departure that he was destined to fulfill at Jerusalem.
Luke	42	9	32	Now Peter and those with him were weighed down with sleep; but when they got fully awake they saw his glory and the two men standing with him.
Luke	42	9	33	And as these were being separated from him, Peter said to Jesus: “Instructor, it is fine for us to be here, so let us erect three tents, one for you and one for Moses and one for Elijah,” he not realizing what he was saying.
Luke	42	9	34	But as he was saying these things a cloud formed and began to overshadow them. As they entered into the cloud, they became fearful.
Luke	42	9	35	And a voice came out of the cloud, saying: “This is my Son, the one that has been chosen. Listen to him.”
Luke	42	9	36	And as the voice occurred Jesus was found alone. But they kept quiet and did not report to anyone in those days any of the things they saw.
Luke	42	9	37	On the succeeding day, when they got down from the mountain, a great crowd met him.
Luke	42	9	38	And, look! a man cried out from the crowd, saying: “Teacher, I beg you to take a look at my son, because he is my only-begotten,
Luke	42	9	39	and, look! a spirit takes him, and suddenly he cries out, and it throws him into convulsions with foam, and it scarcely withdraws from him after bruising him.
Luke	42	9	40	And I begged your disciples to expel it, but they could not.”
Luke	42	9	41	In response Jesus said: “O faithless and twisted generation, how long must I continue with YOU and put up with YOU? Lead your son over here.”
Luke	42	9	42	But even as he was approaching, the demon dashed him to the ground and violently convulsed him. However, Jesus rebuked the unclean spirit and healed the boy and delivered him to his father.
Luke	42	9	43	Well, they all began to be astounded at the majestic power of God. Now as they were all marveling at all the things he was doing, he said to his disciples:
Luke	42	9	44	“Give lodgment to these words in YOUR ears, for the Son of man is destined to be delivered into the hands of men.”
Luke	42	9	45	But they continued without understanding of this saying. In fact, it was concealed from them that they might not see through it, and they were afraid to question him about this saying.
Luke	42	9	46	Then a reasoning entered among them as to who would be the greatest of them.
Luke	42	9	47	Jesus, knowing the reasoning of their hearts, took a young child, set it beside him
Luke	42	9	48	and said to them: “Whoever receives this young child on the basis of my name receives me too, and whoever receives me receives him also that sent me forth. For he that conducts himself as a lesser one among all of YOU is the one that is great.”
Luke	42	9	49	In response John said: “Instructor, we saw a certain man expelling demons by the use of your name and we tried to prevent him, because he is not following with us.”
Luke	42	9	50	But Jesus said to him: “Do not YOU men try to prevent him, for he that is not against YOU is for YOU.”
Luke	42	9	51	As the days were now coming to the full for him to be taken up, he firmly set his face to go to Jerusalem.
Luke	42	9	52	So he sent forth messengers in advance of him. And they went their way and entered into a village of Samaritans, to make preparation for him;
Luke	42	9	53	but they did not receive him, because his face was set for going to Jerusalem.
Luke	42	9	54	When the disciples James and John saw this they said: “Lord, do you want us to tell fire to come down from heaven and annihilate them?”
Luke	42	9	55	But he turned and rebuked them.
Luke	42	9	56	So they went to a different village.
Luke	42	9	57	Now as they were going on the road, someone said to him: “I will follow you to wherever you may depart.”
Luke	42	9	58	And Jesus said to him: “Foxes have dens and birds of heaven have roosts, but the Son of man has nowhere to lay down his head.”
Luke	42	9	59	Then he said to another: “Be my follower.” The man said: “Permit me first to leave and bury my father.”
Luke	42	9	60	But he said to him: “Let the dead bury their dead, but you go away and declare abroad the kingdom of God.”
Luke	42	9	61	And still another said: “I will follow you, Lord; but first permit me to say good-bye to those in my household.”
Luke	42	9	62	Jesus said to him: “No man that has put his hand to a plow and looks at the things behind is well fitted for the kingdom of God.”
book	book_id	chapter	verse	text
Luke	42	10	1	After these things the Lord designated seventy others and sent them forth by twos in advance of him into every city and place to which he himself was going to come.
Luke	42	10	2	Then he began to say to them: “The harvest, indeed, is great, but the workers are few. Therefore beg the Master of the harvest to send out workers into his harvest.
Luke	42	10	3	Go forth. Look! I am sending YOU forth as lambs in among wolves.
Luke	42	10	4	Do not carry a purse, nor a food pouch, nor sandals, and do not embrace anybody in greeting along the road.
Luke	42	10	5	Wherever YOU enter into a house say first, ‘May this house have peace.’
Luke	42	10	6	And if a friend of peace is there, YOUR peace will rest upon him. But if there is not, it will turn back to YOU.
Luke	42	10	7	So stay in that house, eating and drinking the things they provide, for the worker is worthy of his wages. Do not be transferring from house to house.
Luke	42	10	8	“Also, wherever YOU enter into a city and they receive YOU, eat the things set before YOU,
Luke	42	10	9	and cure the sick ones in it, and go on telling them, ‘The kingdom of God has come near to YOU.’
Luke	42	10	10	But wherever YOU enter into a city and they do not receive YOU, go out into its broad ways and say,
Luke	42	10	11	‘Even the dust that got stuck to our feet from YOUR city we wipe off against YOU. Nevertheless, keep this in mind, that the kingdom of God has come near.’
Luke	42	10	12	I tell YOU that it will be more endurable for Sodom in that day than for that city.
Luke	42	10	13	“Woe to you, Chorazin! Woe to you, Bethsaida! because if the powerful works that have taken place in YOU had taken place in Tyre and Sidon, they would long ago have repented sitting in sackcloth and ashes.
Luke	42	10	14	Consequently it will be more endurable for Tyre and Sidon in the judgment than for YOU.
Luke	42	10	15	And you, Capernaum, will you perhaps be exalted to heaven? Down to Hades you will come!
Luke	42	10	16	“He that listens to YOU listens to me too. And he that disregards YOU disregards me too. Moreover, he that disregards me disregards also him that sent me forth.”
Luke	42	10	17	Then the seventy returned with joy, saying: “Lord, even the demons are made subject to us by the use of your name.”
Luke	42	10	18	At that he said to them: “I began to behold Satan already fallen like lightning from heaven.
Luke	42	10	19	Look! I have given YOU the authority to trample underfoot serpents and scorpions, and over all the power of the enemy, and nothing will by any means do YOU hurt.
Luke	42	10	20	Nevertheless, do not rejoice over this, that the spirits are made subject to YOU, but rejoice because YOUR names have been inscribed in the heavens.”
Luke	42	10	21	In that very hour he became overjoyed in the holy spirit and said: “I publicly praise you, Father, Lord of heaven and earth, because you have carefully hidden these things from wise and intellectual ones, and have revealed them to babes. Yes, O Father, because to do thus came to be the way approved by you.
Luke	42	10	22	All things have been delivered to me by my Father, and who the Son is no one knows but the Father; and who the Father is, no one knows but the Son, and he to whom the Son is willing to reveal him.”
Luke	42	10	23	With that he turned to the disciples by themselves and said: “Happy are the eyes that behold the things YOU are beholding.
Luke	42	10	24	For I say to YOU, Many prophets and kings desired to see the things YOU are beholding but did not see them, and to hear the things YOU are hearing but did not hear them.”
Luke	42	10	25	Now, look! a certain man versed in the Law rose up, to test him out, and said: “Teacher, by doing what shall I inherit everlasting life?”
Luke	42	10	26	He said to him: “What is written in the Law? How do you read?”
Luke	42	10	27	In answer he said: “‘You must love Jehovah your God with your whole heart and with your whole soul and with your whole strength and with your whole mind,’ and, ‘your neighbor as yourself.’”
Luke	42	10	28	He said to him: “You answered correctly; ‘keep on doing this and you will get life.’”
Luke	42	10	29	But, wanting to prove himself righteous, the man said to Jesus: “Who really is my neighbor?”
Luke	42	10	30	In reply Jesus said: “A certain man was going down from Jerusalem to Jericho and fell among robbers, who both stripped him and inflicted blows, and went off, leaving him half-dead.
Luke	42	10	31	Now, by coincidence, a certain priest was going down over that road, but, when he saw him, he went by on the opposite side.
Luke	42	10	32	Likewise, a Levite also, when he got down to the place and saw him, went by on the opposite side.
Luke	42	10	33	But a certain Samaritan traveling the road came upon him and, at seeing him, he was moved with pity.
Luke	42	10	34	So he approached him and bound up his wounds, pouring oil and wine upon them. Then he mounted him upon his own beast and brought him to an inn and took care of him.
Luke	42	10	35	And the next day he took out two denarii, gave them to the innkeeper, and said, ‘Take care of him, and whatever you spend besides this, I will repay you when I come back here.’
Luke	42	10	36	Who of these three seems to you to have made himself neighbor to the man that fell among the robbers?”
Luke	42	10	37	He said: “The one that acted mercifully toward him.” Jesus then said to him: “Go your way and be doing the same yourself.”
Luke	42	10	38	Now as they were going their way he entered into a certain village. Here a certain woman named Martha received him as guest into the house.
Luke	42	10	39	This woman also had a sister called Mary, who, however, sat down at the feet of the Lord and kept listening to his word.
Luke	42	10	40	Martha, on the other hand, was distracted with attending to many duties. So, she came near and said: “Lord, does it not matter to you that my sister has left me alone to attend to things? Tell her, therefore, to join in helping me.”
Luke	42	10	41	In answer the Lord said to her: “Martha, Martha, you are anxious and disturbed about many things.
Luke	42	10	42	A few things, though, are needed, or just one. For her part, Mary chose the good portion, and it will not be taken away from her.”
book	book_id	chapter	verse	text
Luke	42	11	1	Now on the occasion of his being in a certain place praying, when he stopped, a certain one of his disciples said to him: “Lord, teach us how to pray, just as John also taught his disciples.”
Luke	42	11	2	Then he said to them: “Whenever YOU pray, say, ‘Father, let your name be sanctified. Let your kingdom come.
Luke	42	11	3	Give us our bread for the day according to the day’s requirement.
Luke	42	11	4	And forgive us our sins, for we ourselves also forgive everyone that is in debt to us; and do not bring us into temptation.’”
Luke	42	11	5	Further, he said to them: “Who of YOU will have a friend and will go to him at midnight and say to him, ‘Friend, loan me three loaves,
Luke	42	11	6	because a friend of mine has just come to me on a journey and I have nothing to set before him’?
Luke	42	11	7	And that one from inside says in reply, ‘Quit making me trouble. The door is already locked, and my young children are with me in bed; I cannot rise up and give you anything.’
Luke	42	11	8	I tell YOU, Although he will not rise up and give him anything because of being his friend, certainly because of his bold persistence he will get up and give him what things he needs.
Luke	42	11	9	Accordingly I say to YOU, Keep on asking, and it will be given YOU; keep on seeking, and YOU will find; keep on knocking, and it will be opened to YOU.
Luke	42	11	10	For everyone asking receives, and everyone seeking finds, and to everyone knocking it will be opened.
Luke	42	11	11	Indeed, which father is there among YOU who, if his son asks for a fish, will perhaps hand him a serpent instead of a fish?
Luke	42	11	12	Or if he also asks for an egg, will hand him a scorpion?
Luke	42	11	13	Therefore, if YOU, although being wicked, know how to give good gifts to YOUR children, how much more so will the Father in heaven give holy spirit to those asking him!”
Luke	42	11	14	Later he was expelling a dumb demon. After the demon came out, the dumb man spoke. And the crowds marveled.
Luke	42	11	15	But certain ones of them said: “He expels the demons by means of Beelzebub the ruler of the demons.”
Luke	42	11	16	However, others, to tempt him, began seeking a sign out of heaven from him.
Luke	42	11	17	Knowing their imaginations he said to them: “Every kingdom divided against itself comes to desolation, and a house divided against itself falls.
Luke	42	11	18	So if Satan is also divided against himself, how will his kingdom stand? Because YOU say I expel the demons by means of Beelzebub.
Luke	42	11	19	If it is by means of Beelzebub I expel the demons, by whom do YOUR sons expel them? Because of this they will be judges of YOU.
Luke	42	11	20	But if it is by means of God’s finger I expel the demons, the kingdom of God has really overtaken YOU.
Luke	42	11	21	When a strong man, well armed, guards his palace, his belongings continue in peace.
Luke	42	11	22	But when someone stronger than he is comes against him and conquers him, he takes away his full armament in which he was trusting, and he divides out the things he despoiled him of.
Luke	42	11	23	He that is not on my side is against me, and he that does not gather with me scatters.
Luke	42	11	24	“When an unclean spirit comes out of a man, it passes through parched places in search of a resting-place, and, after finding none, it says, ‘I will return to my house out of which I moved.’
Luke	42	11	25	And on arriving it finds it swept clean and adorned.
Luke	42	11	26	Then it goes its way and takes along seven different spirits more wicked than itself, and, after getting inside, they dwell there; and the final circumstances of that man become worse than the first.”
Luke	42	11	27	Now as he was saying these things a certain woman out of the crowd raised her voice and said to him: “Happy is the womb that carried you and the breasts that you sucked!”
Luke	42	11	28	But he said: “No, rather, Happy are those hearing the word of God and keeping it!”
Luke	42	11	29	When the crowds were massing together, he started to say: “This generation is a wicked generation; it looks for a sign. But no sign will be given it except the sign of Jonah.
Luke	42	11	30	For just as Jonah became a sign to the Ninevites, in the same way will the Son of man be also to this generation.
Luke	42	11	31	The queen of the south will be raised up in the judgment with the men of this generation and will condemn them; because she came from the ends of the earth to hear the wisdom of Solomon, but, look! something more than Solomon is here.
Luke	42	11	32	The men of Nineveh will rise in the judgment with this generation and will condemn it; because they repented at what Jonah preached; but, look! something more than Jonah is here.
Luke	42	11	33	After lighting a lamp, a person puts it, not in a vault nor under a measuring basket, but upon the lampstand, that those stepping in may behold the light.
Luke	42	11	34	The lamp of the body is your eye. When your eye is simple, your whole body is also bright; but when it is wicked, your body is also dark.
Luke	42	11	35	Be alert, therefore. Perhaps the light that is in you is darkness.
Luke	42	11	36	Therefore, if your whole body is bright with no part at all dark, it will all be as bright as when a lamp gives you light by its rays.”
Luke	42	11	37	When he had spoken this, a Pharisee requested him to dine with him. So he went in and reclined at the table.
Luke	42	11	38	However, the Pharisee was surprised at seeing that he did not first wash before the dinner.
