book	book_id	chapter	verse	text
Luke	42	1	1	Whereas many have undertaken to compile a statement of the facts that are given full credence among us,
Luke	42	1	2	just as those who from the beginning became eyewitnesses and attendants of the message delivered these to us,
Luke	42	1	3	I resolved also, because I have traced all things from the start with accuracy, to write them in logical order to you, most excellent Theophilus,
Luke	42	1	4	that you may know fully the certainty of the things that you have been taught orally.
Luke	42	1	5	In the days of Herod, king of Judea, there happened to be a certain priest named Zechariah of the division of Abijah, and he had a wife from the daughters of Aaron, and her name was Elizabeth.
Luke	42	1	6	They both were righteous before God because of walking blamelessly in accord with all the commandments and legal requirements of Jehovah.
Luke	42	1	7	But they had no child, because Elizabeth was barren, and they both were well along in years.
Luke	42	1	8	Now as he was acting as priest in the assignment of his division before God,
Luke	42	1	9	according to the solemn practice of the priestly office it became his turn to offer incense when he entered into the sanctuary of Jehovah;
Luke	42	1	10	and all the multitude of the people was praying outside at the hour of offering incense.
Luke	42	1	11	To him Jehovah’s angel appeared, standing at the right side of the incense altar.
Luke	42	1	12	But Zechariah became troubled at the sight, and fear fell upon him.
Luke	42	1	13	However, the angel said to him: “Have no fear, Zechariah, because your supplication has been favorably heard, and your wife Elizabeth will become mother to a son to you, and you are to call his name John.
Luke	42	1	14	And you will have joy and great gladness, and many will rejoice over his birth;
Luke	42	1	15	for he will be great before Jehovah. But he must drink no wine and strong drink at all, and he will be filled with holy spirit right from his mother’s womb;
Luke	42	1	16	and many of the sons of Israel will he turn back to Jehovah their God.
Luke	42	1	17	Also, he will go before him with Elijah’s spirit and power, to turn back the hearts of fathers to children and the disobedient ones to the practical wisdom of righteous ones, to get ready for Jehovah a prepared people.”
Luke	42	1	18	And Zechariah said to the angel: “How am I to be sure of this? For I am aged and my wife is well along in years.”
Luke	42	1	19	In reply the angel said to him: “I am Gabriel, who stands near before God, and I was sent forth to speak with you and declare the good news of these things to you.
Luke	42	1	20	But, look! you will be silent and not able to speak until the day that these things take place, because you did not believe my words, which will be fulfilled in their appointed time.”
Luke	42	1	21	Meanwhile the people continued waiting for Zechariah, and they began to wonder at his delaying in the sanctuary.
Luke	42	1	22	But when he came out he was not able to speak to them, and they perceived that he had just seen a supernatural sight in the sanctuary; and he kept making signs to them, but remained dumb.
Luke	42	1	23	When, now, the days of his public service were fulfilled, he went off to his home.
Luke	42	1	24	But after these days Elizabeth his wife became pregnant; and she kept herself secluded for five months, saying:
Luke	42	1	25	“This is the way Jehovah has dealt with me in these days when he has given me his attention to take away my reproach among men.”
Luke	42	1	26	In her sixth month the angel Gabriel was sent forth from God to a city of Galilee named Nazareth,
Luke	42	1	27	to a virgin promised in marriage to a man named Joseph of David’s house; and the name of the virgin was Mary.
Luke	42	1	28	And when he went in before her he said: “Good day, highly favored one, Jehovah is with you.”
Luke	42	1	29	But she was deeply disturbed at the saying and began to reason out what sort of greeting this might be.
Luke	42	1	30	So the angel said to her: “Have no fear, Mary, for you have found favor with God;
Luke	42	1	31	and, look! you will conceive in your womb and give birth to a son, and you are to call his name Jesus.
Luke	42	1	32	This one will be great and will be called Son of the Most High; and Jehovah God will give him the throne of David his father,
Luke	42	1	33	and he will rule as king over the house of Jacob forever, and there will be no end of his kingdom.”
Luke	42	1	34	But Mary said to the angel: “How is this to be, since I am having no intercourse with a man?”
Luke	42	1	35	In answer the angel said to her: “Holy spirit will come upon you, and power of the Most High will overshadow you. For that reason also what is born will be called holy, God’s Son.
Luke	42	1	36	And, look! Elizabeth your relative has also herself conceived a son, in her old age, and this is the sixth month for her, the so-called barren woman;
Luke	42	1	37	because with God no declaration will be an impossibility.”
Luke	42	1	38	Then Mary said: “Look! Jehovah’s slave girl! May it take place with me according to your declaration.” At that the angel departed from her.
Luke	42	1	39	So Mary rose in these days and went into the mountainous country with haste, to a city of Judah,
Luke	42	1	40	and she entered into the home of Zechariah and greeted Elizabeth.
Luke	42	1	41	Well, as Elizabeth heard the greeting of Mary, the infant in her womb leaped; and Elizabeth was filled with holy spirit,
Luke	42	1	42	and she called out with a loud cry and said: “Blessed are you among women, and blessed is the fruit of your womb!
Luke	42	1	43	So how is it that this privilege is mine, to have the mother of my Lord come to me?
Luke	42	1	44	For, look! as the sound of your greeting fell upon my ears, the infant in my womb leaped with great gladness.
Luke	42	1	45	Happy too is she that believed, because there will be a complete performance of those things spoken to her from Jehovah.”
Luke	42	1	46	And Mary said: “My soul magnifies Jehovah,
Luke	42	1	47	and my spirit cannot keep from being overjoyed at God my Savior;
Luke	42	1	48	because he has looked upon the low position of his slave girl. For, look! from now on all generations will pronounce me happy;
Luke	42	1	49	because the powerful One has done great deeds for me, and holy is his name;
Luke	42	1	50	and for generations after generations his mercy is upon those who fear him.
Luke	42	1	51	He has performed mightily with his arm, he has scattered abroad those who are haughty in the intention of their hearts.
Luke	42	1	52	He has brought down men of power from thrones and exalted lowly ones;
Luke	42	1	53	he has fully satisfied hungry ones with good things and he has sent away empty those who had wealth.
Luke	42	1	54	He has come to the aid of Israel his servant, to call to mind mercy,
Luke	42	1	55	just as he told to our forefathers, to Abraham and to his seed, forever.”
Luke	42	1	56	Then Mary remained with her about three months, and returned to her own home.
Luke	42	1	57	The time now became due for Elizabeth to give birth, and she became mother to a son.
Luke	42	1	58	And the neighbors and her relatives heard that Jehovah had magnified his mercy to her, and they began to rejoice with her.
Luke	42	1	59	And on the eighth day they came to circumcise the young child, and they were going to call it by the name of its father, Zechariah.
Luke	42	1	60	But its mother answered and said: “No, indeed! but he shall be called John.”
Luke	42	1	61	At this they said to her: “There is no one among your relatives that is called by this name.”
Luke	42	1	62	Then they went asking its father by signs what he wanted it to be called.
Luke	42	1	63	And he asked for a tablet and wrote: “John is its name.” At this they all marveled.
Luke	42	1	64	Instantly his mouth was opened and his tongue loosed and he began to speak, blessing God.
Luke	42	1	65	And fear fell upon all those living in their neighborhood; and in the whole mountainous country of Judea all these things began to be talked around,
Luke	42	1	66	and all that heard made note of it in their hearts, saying: “What really will this young child be?” For the hand of Jehovah was indeed with it.
Luke	42	1	67	And Zechariah its father was filled with holy spirit, and he prophesied, saying:
Luke	42	1	68	“Blessed be Jehovah the God of Israel, because he has turned his attention and performed deliverance toward his people.
Luke	42	1	69	And he has raised up a horn of salvation for us in the house of David his servant,
Luke	42	1	70	just as he, through the mouth of his holy prophets from of old, has spoken
Luke	42	1	71	of a salvation from our enemies and from the hand of all those hating us;
Luke	42	1	72	to perform the mercy in connection with our forefathers and to call to mind his holy covenant,
Luke	42	1	73	the oath that he swore to Abraham our forefather,
Luke	42	1	74	to grant us, after we have been rescued from the hands of enemies, the privilege of fearlessly rendering sacred service to him
Luke	42	1	75	with loyalty and righteousness before him all our days.
Luke	42	1	76	But as for you, young child, you will be called a prophet of the Most High, for you will go in advance before Jehovah to make his ways ready,
Luke	42	1	77	to give knowledge of salvation to his people by forgiveness of their sins,
Luke	42	1	78	because of the tender compassion of our God. With this compassion a daybreak will visit us from on high,
Luke	42	1	79	to give light to those sitting in darkness and death’s shadow, to direct our feet prosperously in the way of peace.”
Luke	42	1	80	And the young child went on growing and getting strong in spirit, and he continued in the deserts until the day of showing himself openly to Israel.
book	book_id	chapter	verse	text
Luke	42	2	1	Now in those days a decree went forth from Caesar Augustus for all the inhabited earth to be registered;
Luke	42	2	2	(this first registration took place when Quirinius was governor of Syria;)
Luke	42	2	3	and all people went traveling to be registered, each one to his own city.
Luke	42	2	4	Of course, Joseph also went up from Galilee, out of the city of Nazareth, into Judea, to David’s city, which is called Bethlehem, because of his being a member of the house and family of David,
Luke	42	2	5	to get registered with Mary, who had been given him in marriage as promised, at present heavy with child.
Luke	42	2	6	While they were there, the days came to the full for her to give birth.
Luke	42	2	7	And she gave birth to her son, the firstborn, and she bound him with cloth bands and laid him in a manger, because there was no place for them in the lodging room.
Luke	42	2	8	There were also in that same country shepherds living out of doors and keeping watches in the night over their flocks.
Luke	42	2	9	And suddenly Jehovah’s angel stood by them, and Jehovah’s glory gleamed around them, and they became very fearful.
Luke	42	2	10	But the angel said to them: “Have no fear, for, look! I am declaring to YOU good news of a great joy that all the people will have,
Luke	42	2	11	because there was born to YOU today a Savior, who is Christ the Lord, in David’s city.
Luke	42	2	12	And this is a sign for YOU: YOU will find an infant bound in cloth bands and lying in a manger.”
Luke	42	2	13	And suddenly there came to be with the angel a multitude of the heavenly army, praising God and saying:
Luke	42	2	14	“Glory in the heights above to God, and upon earth peace among men of goodwill.”
Luke	42	2	15	So when the angels had departed from them into heaven, the shepherds began saying to one another: “Let us by all means go clear to Bethlehem and see this thing that has taken place, which Jehovah has made known to us.”
Luke	42	2	16	And they went with haste and found Mary as well as Joseph, and the infant lying in the manger.
Luke	42	2	17	When they saw it, they made known the saying that had been spoken to them concerning this young child.
Luke	42	2	18	And all that heard marveled over the things told them by the shepherds,
Luke	42	2	19	but Mary began to preserve all these sayings, drawing conclusions in her heart.
Luke	42	2	20	Then the shepherds went back, glorifying and praising God for all the things they heard and saw, just as these had been told them.
Luke	42	2	21	Now when eight days came to the full for circumcising him, his name was also called Jesus, the name called by the angel before he was conceived in the womb.
Luke	42	2	22	Also, when the days for purifying them according to the law of Moses came to the full, they brought him up to Jerusalem to present him to Jehovah,
Luke	42	2	23	just as it is written in Jehovah’s law: “Every male opening a womb must be called holy to Jehovah,”
Luke	42	2	24	and to offer sacrifice according to what is said in the law of Jehovah: “A pair of turtledoves or two young pigeons.”
Luke	42	2	25	And, look! there was a man in Jerusalem named Simeon, and this man was righteous and reverent, waiting for Israel’s consolation, and holy spirit was upon him.
Luke	42	2	26	Furthermore, it had been divinely revealed to him by the holy spirit that he would not see death before he had seen the Christ of Jehovah.
Luke	42	2	27	Under the power of the spirit he now came into the temple; and as the parents brought the young child Jesus in to do for it according to the customary practice of the law,
Luke	42	2	28	he himself received it into his arms and blessed God and said:
Luke	42	2	29	“Now, Sovereign Lord, you are letting your slave go free in peace according to your declaration;
Luke	42	2	30	because my eyes have seen your means of saving
Luke	42	2	31	that you have made ready in the sight of all the peoples,
Luke	42	2	32	a light for removing the veil from the nations and a glory of your people Israel.”
Luke	42	2	33	And its father and mother continued wondering at the things being spoken about it.
Luke	42	2	34	Also, Simeon blessed them, but said to Mary its mother: “Look! This one is laid for the fall and the rising again of many in Israel and for a sign to be talked against
Luke	42	2	35	(yes, a long sword will be run through the soul of you yourself), in order that the reasonings of many hearts may be uncovered.”
Luke	42	2	36	Now there was Anna a prophetess, Phanuel’s daughter, of Asher’s tribe (this woman was well along in years, and had lived with a husband for seven years from her virginity,
Luke	42	2	37	and she was a widow now eighty-four years old), who was never missing from the temple, rendering sacred service night and day with fastings and supplications.
Luke	42	2	38	And in that very hour she came near and began returning thanks to God and speaking about the child to all those waiting for Jerusalem’s deliverance.
Luke	42	2	39	So when they had carried out all the things according to the law of Jehovah, they went back into Galilee to their own city Nazareth.
Luke	42	2	40	And the young child continued growing and getting strong, being filled with wisdom, and God’s favor continued upon him.
Luke	42	2	41	Now his parents were accustomed to go from year to year to Jerusalem for the festival of the passover.
Luke	42	2	42	And when he became twelve years old, they went up according to the custom of the festival
Luke	42	2	43	and completed the days. But when they were returning, the boy Jesus remained behind in Jerusalem, and his parents did not notice it.
Luke	42	2	44	Assuming that he was in the company traveling together, they covered a day’s distance and then began to hunt him up among the relatives and acquaintances.
Luke	42	2	45	But, not finding him, they returned to Jerusalem, making a diligent search for him.
Luke	42	2	46	Well, after three days they found him in the temple, sitting in the midst of the teachers and listening to them and questioning them.
Luke	42	2	47	But all those listening to him were in constant amazement at his understanding and his answers.
Luke	42	2	48	Now when they saw him they were astounded, and his mother said to him: “Child, why did you treat us this way? Here your father and I in mental distress have been looking for you.”
Luke	42	2	49	But he said to them: “Why did YOU have to go looking for me? Did YOU not know that I must be in the house of my Father?”
Luke	42	2	50	However, they did not grasp the saying that he spoke to them.
Luke	42	2	51	And he went down with them and came to Nazareth, and he continued subject to them. Also, his mother carefully kept all these sayings in her heart.
Luke	42	2	52	And Jesus went on progressing in wisdom and in physical growth and in favor with God and men.
book	book_id	chapter	verse	text
Luke	42	3	1	In the fifteenth year of the reign of Tiberius Caesar, when Pontius Pilate was governor of Judea, and Herod was district ruler of Galilee, but Philip his brother was district ruler of the country of Ituraea and Trachonitis, and Lysanias was district ruler of Abilene,
Luke	42	3	2	in the days of chief priest Annas and of Caiaphas, God’s declaration came to John the son of Zechariah in the wilderness.
Luke	42	3	3	So he came into all the country around the Jordan, preaching baptism in symbol of repentance for forgiveness of sins,
Luke	42	3	4	just as it is written in the book of the words of Isaiah the prophet: “Listen! Someone is crying out in the wilderness, ‘Prepare the way of Jehovah, YOU people, make his roads straight.
Luke	42	3	5	Every gully must be filled up, and every mountain and hill leveled down, and the curves must become straight ways and the rough places smooth ways;
Luke	42	3	6	and all flesh will see the saving means of God.’”
Luke	42	3	7	Therefore he began to say to the crowds coming out to be baptized by him: “YOU offspring of vipers, who has intimated to YOU to flee from the coming wrath?
Luke	42	3	8	Therefore produce fruits that befit repentance. And do not start saying within yourselves, ‘As a father we have Abraham.’ For I say to YOU that God has power to raise up children to Abraham from these stones.
Luke	42	3	9	Indeed, the ax is already in position at the root of the trees; every tree, therefore, not producing fine fruit is to be cut down and thrown into the fire.”
Luke	42	3	10	And the crowds would ask him: “What, then, shall we do?”
Luke	42	3	11	In reply he would say to them: “Let the man that has two undergarments share with the man that has none, and let him that has things to eat do the same.”
Luke	42	3	12	But even tax collectors came to be baptized, and they said to him: “Teacher, what shall we do?”
Luke	42	3	13	He said to them: “Do not demand anything more than the tax rate.”
Luke	42	3	14	Also, those in military service would ask him: “What shall we also do?” And he said to them: “Do not harass anybody or accuse anybody falsely, but be satisfied with YOUR provisions.”
Luke	42	3	15	Now as the people were in expectation and all were reasoning in their hearts about John: “May he perhaps be the Christ?”
Luke	42	3	16	John gave the answer, saying to all: “I, for my part, baptize YOU with water; but the one stronger than I am is coming, the lace of whose sandals I am not fit to untie. He will baptize YOU people with holy spirit and fire.
Luke	42	3	17	His winnowing shovel is in his hand to clean up his threshing floor completely and to gather the wheat into his storehouse, but the chaff he will burn up with fire that cannot be put out.”
Luke	42	3	18	Therefore he also gave many other exhortations and continued declaring good news to the people.
Luke	42	3	19	But Herod the district ruler, for being reproved by him concerning Herodias the wife of his brother and concerning all the wicked deeds that Herod did,
Luke	42	3	20	added also this to all those deeds: he locked John up in prison.
Luke	42	3	21	Now when all the people were baptized, Jesus also was baptized and, as he was praying, the heaven was opened up
Luke	42	3	22	and the holy spirit in bodily shape like a dove came down upon him, and a voice came out of heaven: “You are my Son, the beloved; I have approved you.”
Luke	42	3	23	Furthermore, Jesus himself, when he commenced his work, was about thirty years old, being the son, as the opinion was,of Joseph,son of Heli,
Luke	42	3	24	son of Matthat,son of Levi,son of Melchi,son of Jannai,son of Joseph,
Luke	42	3	25	son of Mattathias,son of Amos,son of Nahum,son of Esli,son of Naggai,
Luke	42	3	26	son of Maath,son of Mattathias,son of Semein,son of Josech,son of Joda,
Luke	42	3	27	son of Joanan,son of Rhesa,son of Zerubbabel,son of Shealtiel,son of Neri,
Luke	42	3	28	son of Melchi,son of Addi,son of Cosam,son of Elmadam,son of Er,
Luke	42	3	29	son of Jesus,son of Eliezer,son of Jorim,son of Matthat,son of Levi,
Luke	42	3	30	son of Symeon,son of Judas,son of Joseph,son of Jonam,son of Eliakim,
Luke	42	3	31	son of Melea,son of Menna,son of Mattatha,son of Nathan,son of David,
Luke	42	3	32	son of Jesse,son of Obed,son of Boaz,son of Salmon,son of Nahshon,
Luke	42	3	33	son of Amminadab,son of Arni,son of Hezron,son of Perez,son of Judah,
Luke	42	3	34	son of Jacob,son of Isaac,son of Abraham,son of Terah,son of Nahor,
Luke	42	3	35	son of Serug,son of Reu,son of Peleg,son of Eber,son of Shelah,
Luke	42	3	36	son of Cainan,son of Arpachshad,son of Shem,son of Noah,son of Lamech,
Luke	42	3	37	son of Methuselah,son of Enoch,son of Jared,son of Mahalaleel,son of Cainan,
Luke	42	3	38	son of Enosh,son of Seth,son of Adam,son of God.
book	book_id	chapter	verse	text
Luke	42	4	1	Now Jesus, full of holy spirit, turned away from the Jordan, and he was led about by the spirit in the wilderness
Luke	42	4	2	for forty days, while being tempted by the Devil. Furthermore, he ate nothing in those days, and so, when they were concluded, he felt hungry.
Luke	42	4	3	At this the Devil said to him: “If you are a son of God, tell this stone to become a loaf of bread.”
Luke	42	4	4	But Jesus replied to him: “It is written, ‘Man must not live by bread alone.’”
Luke	42	4	5	So he brought him up and showed him all the kingdoms of the inhabited earth in an instant of time;
Luke	42	4	6	and the Devil said to him: “I will give you all this authority and the glory of them, because it has been delivered to me, and to whomever I wish I give it.
Luke	42	4	7	You, therefore, if you do an act of worship before me, it will all be yours.”
Luke	42	4	8	In reply Jesus said to him: “It is written, ‘It is Jehovah your God you must worship, and it is to him alone you must render sacred service.’”
Luke	42	4	9	Now he led him into Jerusalem and stationed him upon the battlement of the temple and said to him: “If you are a son of God, hurl yourself down from here;
Luke	42	4	10	for it is written, ‘He will give his angels a charge concerning you, to preserve you,’
Luke	42	4	11	and, ‘They will carry you on their hands, that you may at no time strike your foot against a stone.’”
Luke	42	4	12	In answer Jesus said to him: “It is said, ‘You must not put Jehovah your God to the test.’”
Luke	42	4	13	So the Devil, having concluded all the temptation, retired from him until another convenient time.
Luke	42	4	14	Now Jesus returned in the power of the spirit into Galilee. And good talk concerning him spread out through all the surrounding country.
Luke	42	4	15	Also, he began to teach in their synagogues, being held in honor by all.
Luke	42	4	16	And he came to Nazareth, where he had been reared; and, according to his custom on the sabbath day, he entered into the synagogue, and he stood up to read.
Luke	42	4	17	So the scroll of the prophet Isaiah was handed him, and he opened the scroll and found the place where it was written:
Luke	42	4	18	“Jehovah’s spirit is upon me, because he anointed me to declare good news to the poor, he sent me forth to preach a release to the captives and a recovery of sight to the blind, to send the crushed ones away with a release,
Luke	42	4	19	to preach Jehovah’s acceptable year.”
Luke	42	4	20	With that he rolled up the scroll, handed it back to the attendant and sat down; and the eyes of all in the synagogue were intently fixed upon him.
Luke	42	4	21	Then he started to say to them: “Today this scripture that YOU just heard is fulfilled.”
Luke	42	4	22	And they all began to give favorable witness about him and to marvel at the winsome words proceeding out of his mouth, and they were saying: “This is a son of Joseph, is it not?”
Luke	42	4	23	At this he said to them: “No doubt YOU will apply this illustration to me, ‘Physician, cure yourself; the things we heard as having happened in Capernaum do also here in your home territory.’”
Luke	42	4	24	But he said: “Truly I tell YOU that no prophet is accepted in his home territory.
Luke	42	4	25	For instance, I tell YOU in truth, There were many widows in Israel in the days of Elijah, when the heaven was shut up three years and six months, so that a great famine fell upon all the land,
Luke	42	4	26	yet Elijah was sent to none of those women, but only to Zarephath in the land of Sidon to a widow.
Luke	42	4	27	Also, there were many lepers in Israel in the time of Elisha the prophet, yet not one of them was cleansed, but Naaman the man of Syria.”
Luke	42	4	28	Now all those hearing these things in the synagogue became filled with anger;
Luke	42	4	29	and they rose up and hurried him outside the city, and they led him to the brow of the mountain upon which their city had been built, in order to throw him down headlong.
Luke	42	4	30	But he went through the midst of them and continued on his way.
Luke	42	4	31	And he went down to Capernaum, a city of Galilee. And he was teaching them on the sabbath;
Luke	42	4	32	and they were astounded at his way of teaching, because his speech was with authority.
