book	book_id	chapter	verse	text
Luke	42	15	32	but we just had to enjoy ourselves and rejoice, because this your brother was dead and came to life, and he was lost and was found.’”
book	book_id	chapter	verse	text
Luke	42	16	1	Then he went on to say also to the disciples: “A certain man was rich and he had a steward, and this one was accused to him as handling his goods wastefully.
Luke	42	16	2	So he called him and said to him, ‘What is this I hear about you? Hand in the account of your stewardship, for you can no longer manage the house.’
Luke	42	16	3	Then the steward said to himself, ‘What am I to do, seeing that my master will take the stewardship away from me? I am not strong enough to dig, I am ashamed to beg.
Luke	42	16	4	Ah! I know what I shall do, so that, when I am put out of the stewardship, people will receive me into their homes.’
Luke	42	16	5	And calling to him each one of the debtors of his master he proceeded to say to the first, ‘How much are you owing my master?’
Luke	42	16	6	He said, ‘A hundred bath measures of olive oil.’ He said to him, ‘Take your written agreement back and sit down and quickly write fifty.’
Luke	42	16	7	Next, he said to another one, ‘Now you, how much are you owing?’ He said, ‘A hundred cor measures of wheat.’ He said to him, ‘Take your written agreement back and write eighty.’
Luke	42	16	8	And his master commended the steward, though unrighteous, because he acted with practical wisdom; for the sons of this system of things are wiser in a practical way toward their own generation than the sons of the light are.
Luke	42	16	9	“Also, I say to YOU, Make friends for yourselves by means of the unrighteous riches, so that, when such fail, they may receive YOU into the everlasting dwelling places.
Luke	42	16	10	The person faithful in what is least is faithful also in much, and the person unrighteous in what is least is unrighteous also in much.
Luke	42	16	11	Therefore, if YOU have not proved yourselves faithful in connection with the unrighteous riches, who will entrust YOU with what is true?
Luke	42	16	12	And if YOU have not proved yourselves faithful in connection with what is another’s, who will give YOU what is for yourselves?
Luke	42	16	13	No house servant can be a slave to two masters; for, either he will hate the one and love the other, or he will stick to the one and despise the other. YOU cannot be slaves to God and to riches.”
Luke	42	16	14	Now the Pharisees, who were money lovers, were listening to all these things, and they began to sneer at him.
Luke	42	16	15	Consequently he said to them: “YOU are those who declare yourselves righteous before men, but God knows YOUR hearts; because what is lofty among men is a disgusting thing in God’s sight.
Luke	42	16	16	“The Law and the Prophets were until John. From then on the kingdom of God is being declared as good news, and every sort of person is pressing forward toward it.
Luke	42	16	17	Indeed, it is easier for heaven and earth to pass away than for one particle of a letter of the Law to go unfulfilled.
Luke	42	16	18	“Everyone that divorces his wife and marries another commits adultery, and he that marries a woman divorced from a husband commits adultery.
Luke	42	16	19	“But a certain man was rich, and he used to deck himself with purple and linen, enjoying himself from day to day with magnificence.
Luke	42	16	20	But a certain beggar named Lazarus used to be put at his gate, full of ulcers
Luke	42	16	21	and desiring to be filled with the things dropping from the table of the rich man. Yes, too, the dogs would come and lick his ulcers.
Luke	42	16	22	Now in course of time the beggar died and he was carried off by the angels to the bosom position of Abraham. “Also, the rich man died and was buried.
Luke	42	16	23	And in Hades he lifted up his eyes, he existing in torments, and he saw Abraham afar off and Lazarus in the bosom position with him.
Luke	42	16	24	So he called and said, ‘Father Abraham, have mercy on me and send Lazarus to dip the tip of his finger in water and cool my tongue, because I am in anguish in this blazing fire.’
Luke	42	16	25	But Abraham said, ‘Child, remember that you received in full your good things in your lifetime, but Lazarus correspondingly the injurious things. Now, however, he is having comfort here but you are in anguish.
Luke	42	16	26	And besides all these things, a great chasm has been fixed between us and YOU people, so that those wanting to go over from here to YOU people cannot, neither may people cross over from there to us.’
Luke	42	16	27	Then he said, ‘In that event I ask you, father, to send him to the house of my father,
Luke	42	16	28	for I have five brothers, in order that he may give them a thorough witness, that they also should not get into this place of torment.’
Luke	42	16	29	But Abraham said, ‘They have Moses and the Prophets; let them listen to these.’
Luke	42	16	30	Then he said, ‘No, indeed, father Abraham, but if someone from the dead goes to them they will repent.’
Luke	42	16	31	But he said to him, ‘If they do not listen to Moses and the Prophets, neither will they be persuaded if someone rises from the dead.’”
book	book_id	chapter	verse	text
Luke	42	17	1	Then he said to his disciples: “It is unavoidable that causes for stumbling should come. Nevertheless, woe to the one through whom they come!
Luke	42	17	2	It would be of more advantage to him if a millstone were suspended from his neck and he were thrown into the sea than for him to stumble one of these little ones.
Luke	42	17	3	Pay attention to yourselves. If your brother commits a sin give him a rebuke, and if he repents forgive him.
Luke	42	17	4	Even if he sins seven times a day against you and he comes back to you seven times, saying, ‘I repent,’ you must forgive him.”
Luke	42	17	5	Now the apostles said to the Lord: “Give us more faith.”
Luke	42	17	6	Then the Lord said: “If YOU had faith the size of a mustard grain, YOU would say to this black mulberry tree, ‘Be uprooted and planted in the sea!’ and it would obey YOU.
Luke	42	17	7	“Who of YOU is there that has a slave plowing or minding the flock who will say to him when he gets in from the field, ‘Come here at once and recline at the table’?
Luke	42	17	8	Rather, will he not say to him, ‘Get something ready for me to have my evening meal, and put on an apron and minister to me until I am through eating and drinking, and afterward you can eat and drink’?
Luke	42	17	9	He will not feel gratitude to the slave because he did the things assigned, will he?
Luke	42	17	10	So YOU, also, when YOU have done all the things assigned to YOU, say, ‘We are good-for-nothing slaves. What we have done is what we ought to have done.’”
Luke	42	17	11	And while he was going to Jerusalem he was passing through the midst of Samaria and Galilee.
Luke	42	17	12	And as he was entering into a certain village ten leprous men met him, but they stood up afar off.
Luke	42	17	13	And they raised their voices and said: “Jesus, Instructor, have mercy on us!”
Luke	42	17	14	And when he got sight of them he said to them: “Go and show yourselves to the priests.” Then as they were going off their cleansing occurred.
Luke	42	17	15	One of them, when he saw he was healed, turned back, glorifying God with a loud voice.
Luke	42	17	16	And he fell upon his face at Jesus’ feet, thanking him; furthermore, he was a Samaritan.
Luke	42	17	17	In reply Jesus said: “The ten were cleansed, were they not? Where, then, are the other nine?
Luke	42	17	18	Were none found that turned back to give glory to God but this man of another nation?”
Luke	42	17	19	And he said to him: “Rise and be on your way; your faith has made you well.”
Luke	42	17	20	But on being asked by the Pharisees when the kingdom of God was coming, he answered them and said: “The kingdom of God is not coming with striking observableness,
Luke	42	17	21	neither will people be saying, ‘See here!’ or, ‘There!’ For, look! the kingdom of God is in YOUR midst.”
Luke	42	17	22	Then he said to the disciples: “Days will come when YOU will desire to see one of the days of the Son of man but YOU will not see it.
Luke	42	17	23	And people will say to YOU, ‘See there!’ or, ‘See here!’ Do not go out or chase after them.
Luke	42	17	24	For even as the lightning, by its flashing, shines from one part under heaven to another part under heaven, so the Son of man will be.
Luke	42	17	25	First, however, he must undergo many sufferings and be rejected by this generation.
Luke	42	17	26	Moreover, just as it occurred in the days of Noah, so it will be also in the days of the Son of man:
Luke	42	17	27	they were eating, they were drinking, men were marrying, women were being given in marriage, until that day when Noah entered into the ark, and the flood arrived and destroyed them all.
Luke	42	17	28	Likewise, just as it occurred in the days of Lot: they were eating, they were drinking, they were buying, they were selling, they were planting, they were building.
Luke	42	17	29	But on the day that Lot came out of Sodom it rained fire and sulphur from heaven and destroyed them all.
Luke	42	17	30	The same way it will be on that day when the Son of man is to be revealed.
Luke	42	17	31	“On that day let the person that is on the housetop but whose movable things are in the house not come down to pick these up, and the person out in the field, let him likewise not return to the things behind.
Luke	42	17	32	REMEMBER the wife of Lot.
Luke	42	17	33	Whoever seeks to keep his soul safe for himself will lose it, but whoever loses it will preserve it alive.
Luke	42	17	34	I tell YOU, In that night two men will be in one bed; the one will be taken along, but the other will be abandoned.
Luke	42	17	35	There will be two women grinding at the same mill; the one will be taken along, but the other will be abandoned.”
Luke	42	17	36	——
Luke	42	17	37	So in response they said to him: “Where, Lord?” He said to them: “Where the body is, there also the eagles will be gathered together.”
book	book_id	chapter	verse	text
Luke	42	18	1	Then he went on to tell them an illustration with regard to the need for them always to pray and not to give up,
Luke	42	18	2	saying: “In a certain city there was a certain judge that had no fear of God and had no respect for man.
Luke	42	18	3	But there was a widow in that city and she kept going to him, saying, ‘See that I get justice from my adversary at law.’
Luke	42	18	4	Well, for a while he was unwilling, but afterward he said to himself, ‘Although I do not fear God or respect a man,
Luke	42	18	5	at any rate, because of this widow’s continually making me trouble, I will see that she gets justice, so that she will not keep coming and pummeling me to a finish.’”
Luke	42	18	6	Then the Lord said: “HEAR what the judge, although unrighteous, said!
Luke	42	18	7	Certainly, then, shall not God cause justice to be done for his chosen ones who cry out to him day and night, even though he is long-suffering toward them?
Luke	42	18	8	I tell YOU, He will cause justice to be done to them speedily. Nevertheless, when the Son of man arrives, will he really find the faith on the earth?”
Luke	42	18	9	But he spoke this illustration also to some who trusted in themselves that they were righteous and who considered the rest as nothing:
Luke	42	18	10	“Two men went up into the temple to pray, the one a Pharisee and the other a tax collector.
Luke	42	18	11	The Pharisee stood and began to pray these things to himself, ‘O God, I thank you I am not as the rest of men, extortioners, unrighteous, adulterers, or even as this tax collector.
Luke	42	18	12	I fast twice a week, I give the tenth of all things I acquire.’
Luke	42	18	13	But the tax collector standing at a distance was not willing even to raise his eyes heavenward, but kept beating his breast, saying, ‘O God, be gracious to me a sinner.’
Luke	42	18	14	I tell YOU, This man went down to his home proved more righteous than that man; because everyone that exalts himself will be humiliated, but he that humbles himself will be exalted.”
Luke	42	18	15	Now people began to bring him also their infants for him to touch these; but on seeing it the disciples began to reprimand them.
Luke	42	18	16	However, Jesus called the infants to him, saying: “Let the young children come to me, and do not try to stop them. For the kingdom of God belongs to suchlike ones.
Luke	42	18	17	Truly I say to YOU, Whoever does not receive the kingdom of God like a young child will by no means get into it.”
Luke	42	18	18	And a certain ruler questioned him, saying: “Good Teacher, by doing what shall I inherit everlasting life?”
Luke	42	18	19	Jesus said to him: “Why do you call me good? Nobody is good, except one, God.
Luke	42	18	20	You know the commandments, ‘Do not commit adultery, Do not murder, Do not steal, Do not bear false witness, Honor your father and mother.’”
Luke	42	18	21	Then he said: “All these I have kept from youth on.”
Luke	42	18	22	After hearing that, Jesus said to him: “There is yet one thing lacking about you: Sell all the things you have and distribute to poor people, and you will have treasure in the heavens; and come be my follower.”
Luke	42	18	23	When he heard this, he became deeply grieved, for he was very rich.
Luke	42	18	24	Jesus looked at him and said: “How difficult a thing it will be for those having money to make their way into the kingdom of God!
Luke	42	18	25	It is easier, in fact, for a camel to get through the eye of a sewing needle than for a rich man to get into the kingdom of God.”
Luke	42	18	26	Those who heard this said: “Who possibly can be saved?”
Luke	42	18	27	He said: “The things impossible with men are possible with God.”
Luke	42	18	28	But Peter said: “Look! We have left our own things and followed you.”
Luke	42	18	29	He said to them: “Truly I say to YOU, There is no one who has left house or wife or brothers or parents or children for the sake of the kingdom of God
Luke	42	18	30	who will not in any way get many times more in this period of time, and in the coming system of things everlasting life.”
Luke	42	18	31	Then he took the twelve aside and said to them: “Look! We are going up to Jerusalem, and all the things written by means of the prophets as to the Son of man will be completed.
Luke	42	18	32	For instance, he will be delivered up to men of the nations and will be made fun of and be treated insolently and spit upon;
Luke	42	18	33	and after scourging him they will kill him, but on the third day he will rise.”
Luke	42	18	34	However, they did not get the meaning of any of these things; but this utterance was hidden from them, and they were not knowing the things said.
Luke	42	18	35	Now as he was getting near to Jericho a certain blind man was sitting beside the road begging.
Luke	42	18	36	Because he heard a crowd moving through he began to inquire what this might mean.
Luke	42	18	37	They reported to him: “Jesus the Nazarene is passing by!”
Luke	42	18	38	At that he cried out, saying: “Jesus, Son of David, have mercy on me!”
Luke	42	18	39	And those going in advance began to tell him sternly to keep quiet, but that much more he kept shouting: “Son of David, have mercy on me.”
Luke	42	18	40	Then Jesus stood still and commanded the man to be led to him. After he got near, Jesus asked him:
Luke	42	18	41	“What do you want me to do for you?” He said: “Lord, let me recover sight.”
Luke	42	18	42	So Jesus said to him: “Recover your sight; your faith has made you well.”
Luke	42	18	43	And instantly he recovered sight, and he began to follow him, glorifying God. Also, all the people, at seeing it, gave praise to God.
book	book_id	chapter	verse	text
Luke	42	19	1	And he entered Jericho and was going through.
Luke	42	19	2	Now here there was a man called by the name Zacchaeus; and he was a chief tax collector, and he was rich.
Luke	42	19	3	Well, he was seeking to see who this Jesus was, but he could not for the crowd, because he was small in size.
Luke	42	19	4	So he ran ahead to an advance position and climbed a fig-mulberry tree in order to see him, because he was about to go through that way.
Luke	42	19	5	Now when Jesus got to the place, he looked up and said to him: “Zacchaeus, hurry and get down, for today I must stay in your house.”
Luke	42	19	6	With that he hurried and got down and with rejoicing he received him as guest.
Luke	42	19	7	But when they saw it, they all fell to muttering, saying: “With a man that is a sinner he went in to lodge.”
Luke	42	19	8	But Zacchaeus stood up and said to the Lord: “Look! The half of my belongings, Lord, I am giving to the poor, and whatever I extorted from anyone by false accusation I am restoring fourfold.”
Luke	42	19	9	At this Jesus said to him: “This day salvation has come to this house, because he also is a son of Abraham.
Luke	42	19	10	For the Son of man came to seek and to save what was lost.”
Luke	42	19	11	While they were listening to these things he spoke in addition an illustration, because he was near Jerusalem and they were imagining that the kingdom of God was going to display itself instantly.
Luke	42	19	12	Therefore he said: “A certain man of noble birth traveled to a distant land to secure kingly power for himself and to return.
Luke	42	19	13	Calling ten slaves of his he gave them ten minas and told them, ‘Do business till I come.’
Luke	42	19	14	But his citizens hated him and sent out a body of ambassadors after him, to say, ‘We do not want this man to become king over us.’
Luke	42	19	15	“Eventually when he got back after having secured the kingly power, he commanded to be called to him these slaves to whom he had given the silver money, in order to ascertain what they had gained by business activity.
Luke	42	19	16	Then the first one presented himself, saying, ‘Lord, your mina gained ten minas.’
Luke	42	19	17	So he said to him, ‘Well done, good slave! Because in a very small matter you have proved yourself faithful, hold authority over ten cities.’
Luke	42	19	18	Now the second came, saying, ‘Your mina, Lord, made five minas.’
Luke	42	19	19	He said to this one also, ‘You, too, be in charge of five cities.’
Luke	42	19	20	But a different one came, saying, ‘Lord, here is your mina, that I kept laid away in a cloth.
Luke	42	19	21	You see, I was in fear of you, because you are a harsh man; you take up what you did not deposit and you reap what you did not sow.’
Luke	42	19	22	He said to him, ‘Out of your own mouth I judge you, wicked slave. You knew, did you, that I am a harsh man, taking up what I did not deposit and reaping what I did not sow?
Luke	42	19	23	Hence why is it you did not put my silver money in a bank? Then on my arrival I would have collected it with interest.’
Luke	42	19	24	“With that he said to those standing by, ‘Take the mina from him and give it to him that has the ten minas.’
Luke	42	19	25	But they said to him, ‘Lord, he has ten minas!’—
Luke	42	19	26	‘I say to YOU, To everyone that has, more will be given; but from the one that does not have, even what he has will be taken away.
Luke	42	19	27	Moreover, these enemies of mine that did not want me to become king over them BRING here and slaughter them before me.’”
Luke	42	19	28	So, after he had said these things, he began to go on ahead, going up to Jerusalem.
Luke	42	19	29	And when he got near to Bethphage and Bethany at the mountain called Mount of Olives, he sent forth two of the disciples,
Luke	42	19	30	saying: “Go into the village that is within sight of YOU, and in it after YOU pass in YOU will find a colt tied, on which none of mankind ever sat. Loose it and bring it.
Luke	42	19	31	But if anyone asks YOU, ‘Why is it YOU are loosing it?’ YOU must speak in this way, ‘The Lord needs it.’”
Luke	42	19	32	So those who were sent forth departed and found it just as he said to them.
Luke	42	19	33	But as they were loosing the colt the owners of it said to them: “Why are YOU loosing the colt?”
Luke	42	19	34	They said: “The Lord needs it.”
Luke	42	19	35	And they led it to Jesus, and they threw their outer garments upon the colt and set Jesus upon it.
Luke	42	19	36	As he moved along they kept spreading their outer garments on the road.
Luke	42	19	37	As soon as he got near the road down the Mount of Olives all the multitude of the disciples started to rejoice and praise God with a loud voice concerning all the powerful works they had seen,
Luke	42	19	38	saying: “Blessed is the One coming as the King in Jehovah’s name! Peace in heaven, and glory in the highest places!”
Luke	42	19	39	However, some of the Pharisees from the crowd said to him: “Teacher, rebuke your disciples.”
Luke	42	19	40	But in reply he said: “I tell YOU, If these remained silent, the stones would cry out.”
Luke	42	19	41	And when he got nearby, he viewed the city and wept over it,
Luke	42	19	42	saying: “If you, even you, had discerned in this day the things having to do with peace—but now they have been hid from your eyes.
Luke	42	19	43	Because the days will come upon you when your enemies will build around you a fortification with pointed stakes and will encircle you and distress you from every side,
Luke	42	19	44	and they will dash you and your children within you to the ground, and they will not leave a stone upon a stone in you, because you did not discern the time of your being inspected.”
Luke	42	19	45	And he entered into the temple and started to throw out those who were selling,
Luke	42	19	46	saying to them: “It is written, ‘And my house will be a house of prayer,’ but YOU made it a cave of robbers.”
Luke	42	19	47	Furthermore, he went teaching daily in the temple. But the chief priests and the scribes and the principal ones of the people were seeking to destroy him;
Luke	42	19	48	and yet they did not find the effective thing for them to do, for the people one and all kept hanging onto him to hear him.
book	book_id	chapter	verse	text
Luke	42	20	1	On one of the days while he was teaching the people in the temple and declaring the good news, the chief priests and the scribes with the older men came near,
Luke	42	20	2	and they spoke up, saying to him: “Tell us by what authority you do these things, or who it is that gave you this authority.”
Luke	42	20	3	In reply he said to them: “I will also ask YOU a question, and YOU tell me:
Luke	42	20	4	Was the baptism of John from heaven or from men?”
Luke	42	20	5	Then among themselves they drew conclusions, saying: “If we say, ‘From heaven,’ he will say, ‘Why is it YOU did not believe him?’
Luke	42	20	6	But if we say, ‘From men,’ the people one and all will stone us, for they are persuaded that John was a prophet.”
Luke	42	20	7	So they replied that they did not know its source.
Luke	42	20	8	And Jesus said to them: “Neither am I telling YOU by what authority I do these things.”
Luke	42	20	9	Then he started to tell the people this illustration: “A man planted a vineyard and let it out to cultivators, and he traveled abroad for considerable time.
Luke	42	20	10	But in due season he sent out a slave to the cultivators, that they might give him some of the fruit of the vineyard. The cultivators, however, sent him away empty, after beating him up.
Luke	42	20	11	But he repeated and sent them a different slave. That one also they beat up and dishonored and sent away empty.
Luke	42	20	12	Yet again he sent a third; this one also they wounded and threw out.
Luke	42	20	13	At this the owner of the vineyard said, ‘What shall I do? I will send my son the beloved. Likely they will respect this one.’
Luke	42	20	14	When the cultivators caught sight of him they went reasoning with one another, saying, ‘This is the heir; let us kill him, that the inheritance may become ours.’
Luke	42	20	15	With that they threw him outside the vineyard and killed him. What, therefore, will the owner of the vineyard do to them?
Luke	42	20	16	He will come and destroy these cultivators and will give the vineyard to others.” On hearing this they said: “Never may that happen!”
Luke	42	20	17	But he looked upon them and said: “What, then, does this that is written mean, ‘The stone which the builders rejected, this has become the chief cornerstone’?
Luke	42	20	18	Everyone falling upon that stone will be shattered. As for anyone upon whom it falls, it will pulverize him.”
Luke	42	20	19	The scribes and the chief priests now sought to get their hands on him in that very hour, but they feared the people; for they perceived that he spoke this illustration with them in mind.
Luke	42	20	20	And, after observing him closely, they sent out men secretly hired to pretend that they were righteous, in order that they might catch him in speech, so as to turn him over to the government and to the authority of the governor.
Luke	42	20	21	And they questioned him, saying: “Teacher, we know you speak and teach correctly and show no partiality, but you teach the way of God in line with truth:
Luke	42	20	22	Is it lawful for us to pay tax to Caesar or not?”
Luke	42	20	23	But he detected their cunning and said to them:
Luke	42	20	24	“Show me a denarius. Whose image and inscription does it have?” They said: “Caesar’s.”
Luke	42	20	25	He said to them: “By all means, then, pay back Caesar’s things to Caesar, but God’s things to God.”
Luke	42	20	26	Well, they were not able to catch him in this saying before the people, but, in amazement at his answer, they said nothing.
